RecipeName,0
Khatti Meethi Lauki Dal Recipe - Sweet & Spicy Bottle Gourd Dal,833
Bihari Karela Aloo Sabzi Recipe,834
Sindhi Tahiri Recipe - Sindhi Style Sweet Rice,835
पारसी बैंगन शिमला मिर्च की सब्ज़ी रेसिपी - Parsi Style Baingan Capsicum Ka Salan (Recipe In Hindi),836
Traditional Bihari Litti Chokha Recipe,837
Karwar NKGSB Style Bharli Vangi Recipe - Brinjal Curry,838
Restaurant Style Paneer Lababdar Recipe,839
Jeera Hing Aloo Recipe - No Onion No Garlic Recipe,840
Cheesy Potatoes Recipe,841
तिल और मूंगफली वाले आलू रेसिपी - Sesame Peanut Potato (Recipe In Hindi),842
Pata Gobi Aur Kele Kofta Curry Recipe - No onion No Garlic,843
Sago Khichdi Recipe (Savory Tapioca Pearls Stir Fry),844
प्याज कुल्चा रेसिपी - Whole Wheat Onion Stuffed Kulcha Recipe,845
Whole Wheat Palak Naan Recipe,846
"Mizoram Inspired Veg Sawhchiar Recipe-Rice Pilaf With Kashmiri Red Chillies, Bay Leaf and Paneer",847
Lal Mathachi Bhaji Recipe - Amaranth Leaves Moong Sprouts Sabzi,848
आलू परवल की सब्ज़ी रेसिपी - Aloo Parwal Sabzi (Recipe In Hindi),849
कश्मीरी वेठ चमन रेसिपी - Paneer in Yogurt Tomato Curry (Recipe In Hindi),850
सफ़ेद अचारी बैंगन रेसिपी - Safed Achari Baingan (Recipe In Hindi),851
Burmese Samosa Soup Recipe,852
Himachali Pahari Auriya Kaddu Recipe - Himachali Tangy Pumpkin Sabzi,853
Goan Style Khatkhatem Recipe (Mixed Vegetable Gravy),854
One Pot Vangi Bath Recipe Using Preethi Electric Pressure Cooker (Brinjal Rice),855
Sakkaravalli Kizhangu Poriyal Recipe - Spicy Sweet Potato Roast,856
Malai Matar Paneer Recipe (Cottage Cheese & Peas In Rich Creamy Gravy),857
Oats Banana And Apple Porridge Recipe For Babies And Toddlers,858
Bengali Luchi Recipe - Bengali Softa Maida Puffed Puri,859
चेटिनाड स्टाइल काली मिर्च मशरुम रेसिपी - Chettinad Style Pepper Mushroom (Recipe In Hindi),860
Brahmin Style Vegetable Kurma Recipe,861
हरे प्याज की पूरी रेसिपी - Hare Pyaaz Ki Puri Recipe,862
वेपम पु रसम रेसिपी - Neem Flower Rasam (Recipe In Hindi),863
Kara Sevai Recipe (Lemon Vermicelli),864
सुखी मेथी मलाई मटर रेसिपी - Dry Methi Malai Matar (Recipe In Hindi),865
Khatua Recipe (Bhojpuri Style Khichdi),866
Chettinad Style Urulai Roast Recipe - Baby Potato Roast,867
Jackfruit Seed Korma Recipe,868
Chaat Masala Recipe,869
दही सुरन की सब्ज़ी रेसिपी - Dahi Suran Ki Sabzi (Recipe In Hindi),870
पालक मखाना रेसिपी - Palak Makhana (Recipe in Hindi),871
Quick Cauliflower Fried Rice Recipe,872
Potoler Dolma Recipe (Bengali Style Stuffed Pointed Gourd Curry),873
Sukhi Urad Dal Sabzi Recipe,874
Burnt Garlic Veg Fried Rice Recipe,875
Harive Soppina Saaru Recipe (Karnataka Style Amaranth Leaves Cooked with Lentils),876
Sabsige Millet Pulav Recipe,877
थंडू कीरई पोरियल रेसिपी - Thandu Keerai Poriyal Recipe,878
Punjabi Style Tinda Sabzi Recipe,879
Homemade Dhansak Masala Powder Recipe,880
Barnyard Millet and Ragi Khichdi Recipe,881
Coffee Recipe With Instant Coffee Powder,882
Manipuri Style Tan Ngang Recipe - Refined Flour/Maida Indian Puri Recipe,883
हरियाली पनीर टिक्का मसाला रेसिपी - Hariyali Paneer Tikka Masala Gravy (Recipe In Hindi),884
South Indian Poli Recipe with Coconut (Obbattu/Bobbattu),885
Moong Ki Khichdi Recipe,886
Bengali Phool Gobhir Paturi Recipe (Cauliflower & Potatoes With Poppy Seed Paste),887
Kongunadu Style Arisi Paruppu Sadam Recipe,888
How To Make Homemade Rose Syrup Recipe,889
Punjabi Garam Masala Powder Recipe,890
तवा पराठा रेसिपी - Tawa Paratha (Recipe in Hindi),891
केरला स्टाइल ओकरा थोरन रेसिपी - Kerala Style Vendakkai Thoran (Recipe In Hindi),892
Gujarati Style Osaman Dal Recipe,893
Chettinad Pattani Kurma Recipe (Chettinad Peas Curry),894
बीटरूट छास रेसिपी - Spiced Beetroot Buttermilk Recipe,895
टमाटर गाजर प्याज का सूप रेसिपी - Healthy Tomato Carrot Onion Soup Recipe,896
Maharashtrian Ambat Goda Dal Recipe,897
Karnataka Style Badanekayi Palya Recipe - Long Brinjal In Spicy Coconut Recipe,898
मसूर दाल मखनी रेसिपी - Masoor Dal Makhani Recipe,899
Kathiawadi Dhokli Nu Shaak Recipe,900
Doodhibhoplyacha Bharit Recipe - Maharashtrian Style Lauki Bharta,901
Cabbage Carrot Onion Pudina Thepla Recipe,902
Cabbage Capsicum Sabzi Recipe - Simla Mirch Patta Gobi Sabzi,903
Doodh Dudhi Recipe- Bottle Gourd In Milk Curry,904
Capsicum Usili Recipe (Tamil Nadu Style Capsicum cooked with lentils spice mix),905
Kathirikai Sundakkai Vathal Kuzhambu Recipe,906
Dappalam Recipe- Andhra Vegetable Stew Recipe,907
अमृतसरी छोले रेसिपी - White Chickpeas In Spicy Gravy (Recipe In Hindi),908
Yellow Pumpkin Pulao Recipe,909
Suran Jo Kheemo Recipe-Sindhi Style Grated Yam Sabzi,910
Wheat Paratha Recipe With Pizza Topping,911
Matar Chi Usal Recipe - Green Peas In A Onion Tomato Gravy,912
Beetroot Garlic Lemon Rasam Recipe,913
तीखा मटर मसाला रेसिपी - Spicy Matar Masala (Recipe In Hindi),914
Awadhi Style Taheri Recipe - Vegetable Rice Pulao Recipe,915
Buckwheat Vegetable Khichdi Recipe,916
Palak Kadhi Recipe - Spinach Kadhi,917
केरला टमाटर फ्राई रेसिपी - Kerala Tomato Fry (Recipe In Hindi),918
Meat Masala Stuffed Bharwa Baingan Recipe,919
Mullangi Poriyal recipe - South Indian Style Radish Stir Fry,920
जयपुरी आलू प्याज की सब्ज़ी रेसिपी - Jaipuri Aloo Pyaz Ki Sabzi (Recipe In Hindi),921
One Pot Vegetable Biryani Recipe In Preethi Electric Pressure Cooker,922
Fada Ni Khichdi Recipe,923
Mushroom Do Pyaza Recipe,924
Sorakaya Masala Curry Recipe - Andhra Style Sorakaya Curry,925
Mumbai Style Tawa Pulao Recipe With Moong Sprouts,926
Goan Soya Mince Potato Chop Recipe,927
Chickpea Salad Recipe With Raw Mango,928
Karela Masala Sabzi Recipe,929
Saag Tofu Recipe (Tofu Simmered in Spiced Mustard & Spinach Leaves),930
Goan Kaju Curry Recipe (Spicy Goan Cashew Nut Curry),931
Chettinad Paruppu Urundai Kuzhambu (Steamed Lentil Balls Cooked in a Tangy Curry) Recipe,932
Khumb Kakuri Potli Kebab Recipe With Sandwich Spread,933
Bajra Ka Kheech Recipe,934
Chettinad Vegetable Biryani Recipe,935
Uttarkhand Style Mixed Bhaddu Dal Recipe,936
Amrood Ni Kari Recipe (Parsi Style Dry Guava Curry Recipe),937
Shahi Tindora Recipe - Tindora In Cashew Nut Gravy,938
Chilli Cheese Mushroom Momo Recipe,939
Kadai Chole Recipe- Dry Chickpeas Masala with Capsicum,940
Vegetable Manchow Soup Recipe,941
Himachali Style Pahari Aloo Palda Recipe - Potatoes In Yogurt Gravy,942
Shahjahani Khichdi Recipe - Spiced Green Moong Dal Khichdi,943
Aloo Bhindi Recipe Flavored With Mustard And Poppy Seeds,944
Mooli And Wadi Ki Sabzi Recipe,945
Bhoplya Cha Bharit Recipe – Maharashtrian Pumpkin Sabzi,946
Mixed Vegetable Pulao Recipe,947
Mushroom Baby Corn Kaalimirri Recipe - Pepper Cashew Gravy,948
No Onion No Garlic Cabbage Kofta Curry Recipe,949
Karuveppilai Kuzhambu Recipe (Tangy & Spicy Curry Leaves Curry),950
Goan Style Mushroom Vindaloo Recipe,951
Saunf Wale Aloo Baingan Recipe - Fennel Spiced Potato And Eggplant,952
Batata nu Shaak Recipe - Aloo Tamatar Ki Sabzi,953
Broccoli Pakora Masala Recipe - Broccoli In Spicy Yogurt Gravy,954
Long Brinjal Poriyal Masala Recipe - Green Baingan Sabzi,955
Menthi Vankaya Recipe - Andhra Style Fenugreek Spiced Baingan,956
Baale Dindu Kadale Palya - Banana Stem Curry With Chickpeas Recipe,957
Healthy Lauki Kofta Curry Recipe | Non Fried Bottle Gourd Kofta Curry | Dhoodi Kofta,958
कॉर्न और मटर की करी रेसिपी - Corn And Peas Curry Recipe,959
केरला स्टाइल बैंगन करी रेसिपी - Kerala Style Eggplant Curry (Recipe In Hindi),960
Paneer Stuffed Bhindi In Ajwain Tomato Gravy Recipe,961
Aluchi Bhaji Recipe - Maharashtrian Style Colocasia Leaves Curry,962
Methi Moong Dal Palak Recipe,963
Pudina Moong Dal Recipe (Mint Moong Dal),964
Udupi Style Thondekayi And Badnekayi Sambar Recipe - Ivy Gourd & Brinjal Sambar,965
Kumaon Style Thechwani Recipe-Mooli Aloo Sabzi,966
Paneer Malai Makhani Biryani Recipe,967
Andhra Style Sorakaya Kura Recipe - Bottle Gourd And Toor Dal Recipe,968
No Onion No Garlic Aloo Gajar Ki Sabzi Recipe,969
Konkani Style Karate Batate Puddi Sagle Recipe - Bitter Gourd & Potato Curry,970
Olya Kaju Chi Amti Recipe - Malvani Cashew Nut Curry,971
Chettinad Mint Potato Biryani Recipe,972
Thengai Paal Kurma Recipe - Mixed Vegetables In Coconut Gravy,973
Kala Chana Pilaf Recipe,974
Whole Wheat Naan Recipe,975
Katachi Amti Recipe (Spicy Accompaniment To Maharashtrian Puran Poli),976
Stuffed Kathal Recipe,977
Spiced Rajma Pulao Recipe - Spiced Kidney Bean Rice,978
Kashmiri Style Apple Tamatar Sabzi Recipe - No Onion No Garlic,979
Hare Chane Ka Pulav Recipe,980
Bengali Style Dhokar Dalna Recipe (Spiced Lentil Cakes in Tomato Gravy Recipe),981
Gan Bian Dou Jiao Recipe (Dry Fried Sichuan Haricot Beans),982
कर्नाटका स्टाइल सोरक्कै पाल्या रेसिपी - Karnataka Style Sorakkai Palya (Recipe In Hindi),983
Dahi Suran Ki Kadhi Recipe - Yam Cooked In Yogurt Curry,984
Cabbage Poricha Kootu Recipe (Red Cabbage) - South Indian Cabbage Dal,985
Keerai Karamani Kuzhambu- Palak Lobia Curry Recipe,986
Onion Rava Bhakri Recipe (Goan Kanyachi Bhakri),987
चटपटी मकई मसाला रेसिपी - Chatpatti Makai Masala Recipe,988
Instant Cucumber Pickle Recipe,989
Rajasthani Khoya Matar Sabzi Recipe,990
पुदीना किनुआ रेसिपी - Pudina Quinoa Recipe,991
Goan Chana Ros Recipe (White Peas Curry),992
वन पॉट वांगी भाथ रेसिपी - One Pot Vangi Bhath Recipe In Hindi,993
Maharashtrian Style Dudhi Kajuchi Sonari Amti Recipe - Bottle Gourd And Cashew Nut Sabzi,994
Chow Chow Thoran (Poriyal) Recipe,995
Kabuli Chana Rasam Recipe,996
Masoor Dal Gassi Recipe - Lentils in Tangy Coconut Curry,997
Kerala Style Kanji Payar Recipe,998
Chenai Kizhangu Masiyal-South Indian Style Yam Masiyal,999
Stuffed Potato Cutlet Recipe With Mint Mayo,1000
ऑरेंज रसम रेसिपी - Orange Rasam Recipe,1001
Methi Malai Matar Recipe - Fenugreek Peas Curry With Cream,1002
Tuvar Ni Dal Recipe - Parsi Toovar Dal,1003
Whole Wheat Onion Stuffed Kulcha Recipe,1004
Kollu Vada Kurma Recipe (Horse Gram Fritters Spicy & Tangy Curry),1005
Green Chilli Vegetable Recipe,1006
Oriya Style Ambila Recipe-Sweet & Spicy Mixed Vegetable Sabzi,1007
खट्टी मीठी टिंडा की सब्ज़ी रेसिपी - Khatti Meethi Tinda Sabzi (Recipe In Hindi),1008
आलू भिंडी मसाला ग्रेवी रेसिपी - Aloo Bhindi Masala Gravy Recipe,1009
तुरई बैंगन की सब्ज़ी रेसिपी - Turai Baingan Ki Sabzi Recipe,1010
Dry Navratan Korma Recipe,1011
एल्लु सादम रेसिपी - Ellu Sadam (Recipe In Hindi),1012
गुट्टी वांकाया रेसिपी - Gutti Vankaya Recipe,1013
मेथी तुरई की सब्ज़ी रेसिपी - Methi Turai Ki Sabzi (Recipe In Hindi),1014
Karnataka Style Sabbasige Rasam Recipe - Dill leave & Toor Dal Rasam,1015
Sweet Corn & Avarakkai Sundal Recipe,1016
काली मिर्च वाली गोभी रेसिपी - Pepper Cauliflower (Recipe In Hindi),1017
Vagharela Chawal Recipe - Parsi Style Brown Rice,1018
Indo-Chinese Paneer Manchurian Recipe,1019
ओरिया स्टाइल मूंग दालमा रेसिपी - Oriya Style Moong Dalma (Recipe In Hindi),1020
Kala Chana Masala Curry Recipe,1021
Kerala Style Pazham Pori Recipe (Banana Fry),1022
Kashmiri Style Modur Pulao Recipe - Kashmiri Sweet Pulao,1023
Thotakura Majjiga Pulusu Recipe - Amaranth Leaves in Buttermilk Stew,1024
Matar Butter Masala Recipe,1025
पंजाबी मेथी कढ़ी रेसिपी - Punjabi Methi Kadhi Recipe,1026
Jaisalmer Kala Chana Kadhi Recipe - Rajasthani Chickpea Curry,1027
Dal Shorba Recipe - Indian Style Lentil Soup,1028
Baked Vegetable Seekh Kebab Recipe,1029
थक्काली रसम रेसिपी - Thakkali Rasam Recipe,1030
खट्टे पुदीने वाले आलू रेसिपी - Tangy Mint Potatoes (Recipe In Hindi),1031
Manathakkali Kootu Recipe,1032
Paneer Gassi Recipe,1033
Chow Chow Thakkali Kootu Recipe - Chayote Squash In Dal Coconut Curry,1034
Andhra Style Pachi Pulusu Recipe -Raw Tamarind Rasam,1035
Kala Chana Amti Recipe - Maharashtrian Black Chickpea Curry,1036
Sindhi Kadhi Recipe,1037
Paneer Shashlik Recipe,1038
Awadhi Style Dal Masoor Musallam Recipe,1039
Narkel Diye Cholar Dal Recipe (Bengali Chana Dal With Fried Coconut Slices),1040
Matar Millet Pulao Recipe - Peas Pulao Recipe,1041
कोवक्कै पौड़ी करी रेसिपी - Kovakkai Podi Curry Recipe,1042
मारवाड़ी गट्टे की कढ़ी रेसिपी - Marwadi Gatte Ki Kadhi Recipe,1043
Kala Chana Masala Recipe,1044
बंगाली आलू झिंगे पोश्तो करी रेसिपी - Bengali Aloo Jhinge Posto Curry (Recipe In Hindi)),1045
Paneer Stuffed Mushroom Masala Recipe,1046
Manipuri Style Alu Kangmet Recipe - Mashed Potato In Dry Red Chillies,1047
Mughlai Aloo Lajawab Recipe - Mughlai Aloo Sabzi Recipe,1048
Mugachi Usal Recipe -Spicy Moong Sprouted Sabzi,1049
आम की सब्ज़ी रेसिपी - Mango Curry Recipe,1050
Baby Potato Theeyal Recipe - Kerala Style Potatoes In Shallots And Roasted Coconut,1051
Chow Chow and Carrot Kootu Recipe,1052
Pumpkin Erissery Recipe - Kerala Pumpkin Coconut Curry,1053
Sesame Peanut Potato Mix Recipe,1054
ओरिया स्टाइल घण्टा तरकारी रेसिपी - Oriya Style Ghanta Tarkari (Recipe In Hindi),1055
भरमा कटहल की सब्ज़ी रेसिपी - Stuffed Jackfruit Curry (Recipe In Hindi),1056
Paal Kozhukattai Recipe With Bananas - With Vegan Option,1057
Maharashtrian Kalanyachi Bhakri Recipe With Groundnut Chutney,1058
Maash Ki Dal Khasgi Recipe (Dhaba Style Urad Dal),1059
Vempampoo Rice Recipe (Dried Neem Flowers Rice),1060
Menthe / Fenugreek Seeds Tambli Recipe (Karnataka Recipes),1061
"South Indian Style Green Moong Sprouts, Raw Mango Salad Recipe",1062
Instant Mixed Vegetable Pickle Recipe,1063
तिल के आलू रेसिपी - Til Ke Aloo (Recipe In Hindi),1064
Kaju Butter Masala Recipe,1065
Aloo Patta Gobi Sabzi Recipe - Potato Cabbage Sabzi,1066
हैदराबाद स्टाइल कुस्का रेसिपी - Hyderabad Style Kuska Recipe,1067
Chinese Style Green Beans Recipe,1068
Raw Banana and Banana Stem Stuffed Paratha Recipe,1069
Cheesy Pav Bhaji Recipe,1070
Enchorer Torkari Recipe - Bengali Style Raw Jackfruit in Semi-gravy,1071
Muga Ambat Recipe,1072
Vepampoo Kara Kuzhambu Recipe (Dried Neem Flower Gravy),1073
Cauliflower Rice and Lentil Curry Recipe,1074
Persian Eggplant Stew Recipe (Khoresht Bademjan),1075
Paneer Pav Bhaji Recipe - Wholesome Weeknight Dinner,1076
Andhra Style Beetroot Vepudu Recipe (Stir Fried Beetroot),1077
Baby Corn & Tomato Masala Bath-Rice Spiced With Pav Bhaji Masala,1078
Karnataka Style Kadle Kaalu Saru Recipe (Black Chickpea Curry Recipe),1079
Ragi Or Finger Millet Powder/ Malt Recipe for Babies 6 Months & Above,1080
Banana Stem Thoran Recipe - Ayurvedic No Onion No Garlic Recipe,1081
Chettinad Vegetable Pulav Recipe -,1082
Papad Parathas Recipe,1083
Methi Bajra Poori Recipe,1084
Karela Bajji Recipe - Pavakkai Bajji Recipe | Bittergourd,1085
Cajun Style Potatoes Recipe,1086
Bhatt Ki Dal Recipe - Traditional Kumaoni Black Bean Dal,1087
Sukhi Dahi Wali Lauki Recipe - Yogurt Based Bottle Gourd Sabzi,1088
Peanut Curry Recipe,1089
Healthy Tomato Carrot Onion Soup Recipe,1090
Rajasthani Gunde Ka Achaar Recipe (Bird Lime Pickle),1091
Spicy Goan Style Mushrooms Recipe,1092
Dal Kabila Recipe - Diabetic Urad Dal Tadka,1093
Mirchi And Aloo Curry Recipe - Long Green Chilli And Potato Curry,1094
Bardoli Ki Khichdi Recipe,1095
Stuffed Makai Paratha Recipe (Corn & Coriander Stuffed Flat Bread),1096
Kashmir Style Bom Chount/Wangan Recipe-Spicy Apple Brinjal Curry,1097
Dahi Wale Tinda Ki Sabzi Recipe - Apple Gourd in Yogurt Curry,1098
Bharli Vangi Recipe - Maharashtrian Style Stuffed Brinjals,1099
Vazhakkai Podimas Recipe (Ayurvedic Recipe With No Onion No Garlic),1100
Moong Dal Karara Recipe,1101
Baby Potatoes Pulao Recipe - Aloo Pulao Recipe,1102
Mango Pulusu Recipe - Mamidi Pandu Pulusu Recipe,1103
तीखा राजमा पुलाव रेसिपी - Spiced Rajma Pulao Recipe,1104
Tofu & Capsicum Paratha Recipe (Stuffed Tofu Flatbread),1105
Baby Corn Stew Recipe,1106
Paneer Tikka Pulao Recipe,1107
Bharma Baingan Ki Sabzi Recipe - Spicy Stuffed Brinjals,1108
UP Style Paneer In Mustard Gravy Recipe,1109
Kara Boondi Kurma Recipe - Boondi In Coconut Milk,1110
Kashmiri Kulith Ki Dal Recipe - Horse Gram Dal Recipe,1111
Carrot Poriyal Recipe - Steamed Carrot Stir Fry,1112
पालक गोभी की सब्ज़ी रेसिपी - Palak Gobi Sabzi (Recipe In Hindi),1113
Punjabi Black Chickpea Curry Recipe - Kale Chane Ki Sabzi,1114
Chatpata Kabuli Chana Salad - Chickpea Salad Recipe,1115
Gawarphali Ki Sabzi Recipe -Cluster Beans Sabzi,1116
Mangalorean Kadle Manoli Recipe  - Tindora Kala Chana Sabzi,1117
Kerala Pumpkin Pachadi Recipe (Parangikai Pachadi),1118
छोटी आलूर दम रेसिपी - Baby Potatoes In Tomato Gravy (Recipe In Hindi),1119
महाराष्ट्रियन आलू भुजने रेसिपी - Maharashtrian Aloo Bhujne (Recipe In Hindi),1120
Vazhakkai Milagu Kootu Recipe - Plantains Pepper Curry,1121
नवरतन कोरमा रेसिपी - Navratan Korma (Recipe In Hindi),1122
Spicy Yogurt Chapati/Roti Recipe,1123
Kerala Style Kappa Ulathiyathu Recipe - Tapioca Stir Fry Recipe,1124
Paneer Peshawari Recipe - Cottage Cheese In Rich Gravy,1125
Aal Ke Kofte (Bottle Gourd Fritters In Spicy Gravy) Recipe,1126
Kathirikai Rasavangi Recipe - Eggplant is a Tangy Coconut Gravy,1127
Spicy Broken Wheat Khichdi With Vegetables Recipe,1128
Spinach Rice Recipe - Palak Pulao,1129
Goan Gawar Bhaji Recipe,1130
Besan Aur Dahi Wali Kacche Kele Ki Sabzi Recipe,1131
Chettinad Style Pepper Mushroom Recipe,1132
Cabbage Palya Recipe,1133
Matar Mushroom Curry Recipe,1134
गाजर गोभी मटर सब्ज़ी रेसिपी - Carrot Cauliflower Peas Sabzi Recipe,1135
Bengali Style Basanti Pulao Recipe,1136
Dahi Methi Puri Recipe - Fenugreek Leaves Puri With Yogurt,1137
Sookha Aloo Matar Methi Sabzi Recipe,1138
Kashmiri Style Tamatar Chaman Recipe -Paneer Cooked With Tomatoes,1139
Nawabi Paneer Curry Recipe,1140
Bihari Makhana Aur Matar Sabzi Recipe,1141
धनिया वाले आलू रेसिपी - Dhania Wale Aloo (Recipe In Hindi),1142
Kerala Style Cauliflower Kurma Recipe,1143
Kodava Kummu Curry Recipe- Coorg Style Mushroom Curry,1144
धनसक मसाला पाउडर रेसिपी - Homemade Dhansak Masala Powder Recipe,1145
Rajasthani Dal Bati Churma Recipe | Dhaba Style recipe,1146
Lemon Rasam Recipe - Nimbe Saaru Recipe,1147
Tawa Paratha Recipe - Plain Paratha,1148
पत्ता गोभी पल्या रेसिपी - Cabbage Palya (Recipe In Hindi),1149
Pitor Ki Sabzi Recipe,1150
फालगुनी दाल रेसिपी - Phalguni Dal Recipe,1151
Cantonese Style Dimsums Recipe-Sweet Corn & Tofu Steamed Dumpling,1152
Masoor Dal Makhni Recipe,1153
पंजाबी लोबिया मसालारेसिपी -Punjabi Style Black Eyed Beans Curry (Recipe In Hindi),1154
Punjabi Bhindi Kadhi Recipe - Roasted Okra In Yogurt Curry,1155
पत्ता गोभी शिमला मिर्च की सब्ज़ी रेसिपी - Cabbage Capsicum Sabzi Recipe,1156
Makhmali Rajma Kebab Recipe,1157
Dahi Turai Ki Sabzi Recipe (Ridge Gourd Simmered In Yogurt Curry Recipe),1158
Tomato Methi Rice Recipe,1159
पर्शियन एग्गप्लांट स्टू रेसिपी - Persian Eggplant Stew Recipe,1160
Spicy Dalia Pulao Recipe - Broken Wheat Pulao,1161
Tomato Gojju (South Indian Style Tomato Curry Recipe),1162
तुवर नी दाल रेसिपी - Parsi Toovar Dal Recipe,1163
Kandathipli And Arisi Thipli Rasam Recipe,1164
स्पाइसी वेजीटेरियन हक्का नूडल्स रेसिपी - Vegetarian Hakka Noodles Recipe,1165
गाजर मेथी की सब्ज़ी रेसिपी - Carrot Fenugreek Leaves Stir Fry (Recipe In Hindi),1166
Pineapple Mushroom Tikka Recipe With Tandoori Masala,1167
पाइनएप्पल लस्सी रेसिपी - Pineapple Lassi Recipe,1168
शकरकंदी और करेला कुलंबु रेसिपी - Sweet Potato And Bitter Gourd Kulambu (Recipe In Hindi),1169
Goan Style Black Chickpeas And Cucumber Masala Recipe (Taushem Tondak),1170
Zunka Recipes (Spicy Gram Flour),1171
चाउ चाउ पोरिचा कूटू रेसिपी - Chow Chow Poricha Kootu Recipe,1172
Lauki Tamatar Ki Sabzi Recipe,1173
Tirunelveli Mor Kuzhambu Recipe,1174
आंध्रा स्टाइल पप्पू चारु रेसिपी - Andhra Style Pappu Charu Recipe,1175
तवा पनीर मसाला रेसिपी - Tawa Paneer Masala (Recipe In Hindi),1176
राजस्थानी सेव टमाटर की सब्ज़ी रेसिपी - Rajasthani Sev Tamatar Ki Sabzi (Recipe In Hindi),1177
वरन भात रेसिपी - Varan Bhaat Recipe,1178
Mixed Vegetable Koora Recipe - Mixed Vegetable Poriyal,1179
Mochar Ghonto Recipe (Traditional Banana Blossom Curry From West Bengal),1180
Pakodi Koora Recipes,1181
Chakolaya Recipe (Maharastrian Varan Phal),1182
Gutti Vankaya Recipe - Andhra Style Stuffed Brinjal,1183
Kashmiri Kesar Pulao - Saffron Fennel Rice Recipe,1184
शकरकंदी और नीम के पत्तो की सब्ज़ी रेसिपी - Sweet Potato & Neem Leaves Vegetable Curry (Recipe In Hindi),1185
Potato And Peas Curry Recipe In Coconut Milk Gravy,1186
कथीरिकै रसा वांगी रेसिपी - Kathirikai Rasa Vangi Recipe,1187
Ajwaini Tamatar Bhindi Recipe,1188
Jal Jeera Recipe - Sweet And Sour Cumin Water Recipe,1189
Awadhi Style Zarda Pulao Recipe,1190
Vellarikka Manga Curry Recipe - Cucumber Mango Pulissery,1191
Gehun Ki Bikaneri Khichdi Recipe (Wheat Kernel And Moong Dal Khichdi),1192
Stuffed Bhindi Recipe With Peanuts,1193
अदरक लहुसन टोफू करी रेसिपी - Ginger Garlic Tofu Curry (Recipe In Hindi),1194
लौकी यखनी रेसिपी - Lauki Yakhini (Recipe In Hindi),1195
Dudhi Dhokli Nu Shaak Recipe - Bottle Gourd And Steamed Dumplings Curry,1196
शिमला मिर्च मसाला रेसिपी - Capsicum Masala Gravy (Recipe In Hindi),1197
Beetroot Poriyal Sabzi Recipe For Babies And Toddlers Over 10 months,1198
चेटिनाड बीन्स और गोभी पोरियल रेसिपी - Chettinad Beans & Cauliflower Poriyal (Recipe In Hindi),1199
Udupi Style Mixed Vegetable Sambar Recipe (Lentil Curry With Vegetables),1200
Paneer Butter Masala Recipe,1201
Radish Greens Poriyal Recipe (South Indian Style Radish Greens Stir Fry),1202
खट्टा मीठा पेठा रेसिपी - Khatta Meetha Petha (Recipe In Hindi),1203
Ambe Dal Recipe - Maharashtrian Salad with Raw Mango & Chana Dal,1204
Green Mango Masoor Dal Recipe,1205
Sabsige Soppu Kootu (Dill Leaf Curry) Recipe,1206
Yeruvalli Kuzhambu Recipe | Iru Puli Kuzhambu | Tangy Coconut Curry,1207
Baked Stuffed Baati With Churma And Panchratna Dal Recipe,1208
महाराष्ट्रियन आलू भूजने रेसिपी - Potato Stir Fry (Recipe In Hindi),1209
Curd Oats Recipe,1210
केरल आलू थियल रेसिपी - Kerala Style Potatoes In Shallots And Roasted Coconut (Recipe In Hindi),1211
Himachali Chana Madra Recipe (Chickpeas In Yogurt Based Gravy),1212
Plain Dalia Recipe- How To Cook Broken Wheat In Pressure Cooker,1213
Thengai Paal Sadam Recipe - Coconut Milk Pulao,1214
Vegetarian Shami Kebab Recipe (Chane Ke Kebab),1215
Ragi Badam Soup Recipe - Finger Millet Almond Soup With Vegetables,1216
Iranian Berry Pulao Recipe With Caramelized Onion & Cranberry,1217
Brinjal Capsicum Sabji Recipe,1218
Ulava Charu Recipe - Spicy Andhra Horse Gram Rasam,1219
Tawa Paneer Masala Recipe,1220
Mango Rice Recipe,1221
Dal Chawal/ Paruppu Sadam -Baby & Toddler Recipe above 10 months,1222
Kosamalli Recipe (Chettinad Style Brinjal and Potato Mash),1223
No Onion No Garlic Black Eyed Beans Curry Recipe,1224
Curd Rice Recipe With Mint Flavour,1225
Goan Style Patol Bhaji Recipe- Green peas Curry Recipe,1226
Nimbu Chunda Recipe (Lemon Chutney) - No Cook And Oil Free,1227
Mixed Vegetable Noodle Cutlet Recipe,1228
Lemon Rice Recipe - Elumichai Sadam/Chitranna,1229
Makhana Moongphali Kadhi With Samvat Rice Recipe,1230
Avarekalu Usli Recipe,1231
Vendaikai (Okra) Puli Kootu Recipe,1232
