RecipeName,0
Patta Gobi Sabzi Recipe - Cabbage Tomato Sabzi,1233
Methi Matar Pulao Recipe - Fenugreek Green Peas Pulao,1234
Masoor Dal And Palak Khichdi Recipe,1235
Udupi Tomato Rasam Recipe,1236
Sweet Dashami Recipe (Maharashtrian Flatbread Made With Wheat Flour & Sugarcane Juice),1237
Lauki Aloo Sabzi Recipe - Bottle Gourd Potato Vegetable Curry,1238
Aloo Beetroot and Baby Corn Mixed Sabzi Recipe,1239
Murungai Keerai Thanni Saaru Recipe-Drumstick Leaves Soup,1240
Rajasthani Chawle Wale Dhokle Recipe,1241
Parsi Style Vegetable Dhansak Recipe- Parsi Vegetable Dal,1242
Karwar Style Valval Recipe (Mixed Vegetables In Coconut Milk),1243
Shukto Recipe - Bengali Mixed Vegetable in Mustard and Poppy Seed Gravy,1244
Bengali Style Raw Jackfruit Curry Recipe - Enchor’er Dalana,1245
"Sweet Corn, Methi & Tomato Rice Recipe",1246
Paneer Bread Balls Recipe -Cottage Cheese & Bread Croquettes,1247
Warqi Paratha Recipe,1248
मसूर मूंगफली की दाल रेसिपी - Masoor Moong Phali Ki Dal Recipe,1249
Jimikand ke Kebab Recipe (Yam Kebabs),1250
Karnataka Style Bendekayi Gojju - Kayirasa Recipe,1251
Kodava Kootu Curry Recipe - Coorg Style Mixed Vegetable Stew,1252
Kela Methi Bhajiya Recipe,1253
Rajma Galouti Kebab Recipe,1254
Suran Moongphali Curry Recipe (Yam/Jimikand Curry with Peanuts),1255
Sprouted Methi & Kachha Aam Salad Recipe,1256
Golden Turmeric Almond Saffron Milk Shot Recipe,1257
Amritsari Dal Recipe,1258
Beetroot Greens Rice Recipe,1259
Masoor Moong Phali Ki Dal Recipe (Masoor Dal With Peanuts Recipe),1260
Peanut Cucumber Salad Recipe,1261
सुखी उरद दाल रेसिपी - Sukhi Urad Dal Sabzi Recipe,1262
पारसी लगन सारा इस्त्यु रेसिपी - Parsi Style Lagan Sara Istew Recipe (Recipe In Hindi),1263
Tangy Corn Tamatar Bharta Recipe,1264
पुलि किरई रेसिपी - Puli Keerai (Recipe In Hindi),1265
पालक कढ़ी रेसिपी - Palak Kadhi Recipe,1266
Wheat Grass Rasam Recipe,1267
Matki Kala Chana Salad Recipe,1268
Delicious Dal Makhani Recipe Without Onion and Garlic (Jain),1269
दही सुरन की कढ़ी रेसिपी - Dahi Suran Ki Kadhi Recipe,1270
Khatti Meethi Ragi Masala Roti Recipe With Carrots,1271
No Onion No Garlic Rajasthani Gatte Ki Kadhi Recipe,1272
कश्मीरी मुंज हाक रेसिपी - Knol Khol Flavored With Asafoetida (Recipe In Hindi),1273
Bengali Aloo Dum Recipe,1274
Masala Couscous Pulao Recipe,1275
Karnataka Style Mixed Vegetable Pulao Recipe,1276
बेक्ड चाइनीज़ आलू रेसिपी - Baked Chinese Potato Recipe,1277
शिमला मिर्च और मशरुम की सब्ज़ी रेसिपी - Pepper Mushroom Stir Fry (Recipe In Hindi),1278
Green Beans Poriyal Recipe With Peanuts & Sesame Recipe,1279
Fusion Spinach Parathas With Onion Tomato Salsa Recipe,1280
चीज़ वाले आलू रेसिपी - Cheesy Potatoes Recipe,1281
Capsicum Curry Recipe,1282
Falahari Rajgira Aloo Tikki Recipe (Gluten Free Amaranth Potato Patty),1283
पनीर मखनी रेसिपी - Paneer Makhani (Recipe In Hindi),1284
Coriander Tamarind Millet Rice Recipe,1285
Cinnamon Spiced Black Lemon Tea Recipe,1286
सिंधी करेला भाजी रेसिपी - Sindhi Karela Bhaji Recipe,1287
Sprouted Moong And Methi Pulao Recipe,1288
Singhara Pulao Recipe - Water Chestnut Mixed Rice,1289
Hyderabadi Shahi Mixed Vegetable Curry Recipe,1290
Jharkhand Dal Peethi Recipe,1291
Masala Roti Recipe-Soft and Spicy Indian Flat Bread,1292
वेजीटेरियन काबुली पुलाव रेसिपी - Vegetarian Kabuli Pulao Recipe,1293
Double Beans Sundal Recipe,1294
Hara Chana Masala Recipe,1295
Khatti Meethi Mooli Ki Sabzi Recipe-Sweet and Tangy Radish Dry Recipe,1296
Manipuri Style Chak Angouba Recipe - Vegetable Pulao Recipe,1297
Malvani Kurkuri Bhindi Recipe - Moongphali Bhindi Sabzi,1298
पोरीचा कोरम्बुरेसिपी - Poricha Kuzhambu Tamil Nadu Style Mixed Vegetables and Lentil Stew (Recipe In Hindi),1299
Lauki Badi Ki Sabzi Recipe,1300
Gujarati Batata Pulao Recipe - Sweet And Spicy Pulao With Lentils And Potatoes,1301
Dill Leaves Toor Dal Recipe - Shepu/ Suva Dal recipe,1302
Karnataka Style Bele Saaru Recipe,1303
जैन स्टाइल कॉर्न पालक - Jain Style Corn Palak (Recipe In Hindi),1304
Chettinad Mushroom And Green Peas Stir Fry Recipe,1305
Sweet Potato And Carrot Sabzi Recipe,1306
Quick Pulao With Onions And Tomatoes Recipe,1307
जुन्का रेसिपी - Spicy Gram Flour Sabzi (Recipe In Hindi),1308
Mogre Ka Sharbat Recipe - Fresh Jasmine Drink,1309
Urulai Kizhangu Roast Recipe - Spicy Potato Roast Recipe,1310
अचारी आलू परवल की सब्ज़ी रेसिपी - Achari Aloo Parwal Sabzi (Recipe In Hindi),1311
Baingan Musallam Recipe (Mughlai Style Eggplant Simmered In Rich Tomato Curry),1312
Mangalorean Style Kuvalyacho Pollav Recipe (Yellow Pumpkin Curry Recipe),1313
पत्ता गोभी की सब्ज़ी - Cabbage Tomato Sabzi (Recipe In Hindi),1314
Vegan Black Beans Stuffed Paratha Recipe,1315
Green Beans Paruppu Usili Recipe - Iyengar Style,1316
Vendakkai Podi Curry Recipe - Vendakkai Poriyal,1317
Sukha Kala Chana Masala Recipe - Ashtami Prasad,1318
चना मेथी दाल रेसिपी - Chana Methi Dal Recipe,1319
Motiya Chilman Pulao Recipe - Vegetable Rice Topped With Paneer Balls,1320
Dal Ghiya with Punjabi Wadiyan Recipe - Lentils with Bottle Gourd & Sundried Lentil Dumplings,1321
Peshawari Chole Recipe,1322
दाल मखनी रेसिपी - Dal Makhani Without Onion And Garlic (Recipe In Hindi),1323
Khandeshi Dal Recipe,1324
Pahari Style Phanu Recipe - Delicious Mixed Dal,1325
जीरा राइस रेसिपी - Jeera Rice (Recipe In Hindi),1326
Maharashtrian Style Sheng Sola Recipe (Vegetable Stew),1327
Thayir Semiya Recipe (Curd Semiya),1328
कढ़ाई मशरुम रेसिपी - Kadai Mushroom (Recipe In Hindi),1329
Hirve Kaalvan Recipe (Fresh Coriander and Coconut Curry),1330
Dahi Wale Makhane Recipe - Lotus Seeds In Curd Gravy,1331
Jolada Ganji Recipe (Jowar Savoury Porridge),1332
केरला अवियल रेसिपी - Kerala Avial (Recipe In Hindi),1333
Menthya Jolada Mudde Recipe - Methi & Jowar Balls Recipe,1334
Drumstick Dal Recipe,1335
शाही भिंडी रेसिपी - Shahi Bhindi Recipe In Cashew Nut Gravy Recipe,1336
Spinach And Millet Pulav Recipe,1337
Mangalorean Style Lobia Gassi Recipe - Black Eyed Peas In Coconut Curry,1338
Maavina Hannina Gojju (Karnataka Style Ripe Mango Curry Recipe),1339
Masala Vadai Kuzhambu Recipe (Mudaliar Style Curried Fritters In Spicy Tamarind Gravy),1340
Bengali Style Chori Recipe-Mixed Vegetable Sabzi,1341
Pumpkin Sabzi Recipe with Panch Phoron Masala,1342
Jaipuri Aloo Pyaz Ki Sabzi Recipe Using Preethi Electric Pressure Cooker,1343
Fajeto Recipe - Gujarati Ripe Mango Curry Recipe,1344
Goan Bimbla Uddamethi Recipe,1345
Kayi Saasive Chitranna Recipe,1346
Malvani Kala Chana Masala Recipe - Spicy Kala Chana Curry,1347
Kuvale Sasam Recipe - Konkani Ash Gourd Curry,1348
Soya Keema Matar Masala Recipe,1349
Bengali Style Kanch kolar Kofta Curry Recipe (Green Plantain Kofta Curry Recipe),1350
Spiced Watermelon Curry Recipe With Carrots & Peppers,1351
Vegetable Handi Biryani Recipe,1352
Hari Dhania Ki Sabzi ( Fresh Coriander leaves Dry Curry) Recipe,1353
Andhra Style Potato Korma Recipe,1354
Broccoli And Tofu Green Curry Recipe,1355
Nepalese Vegetable Pulao Recipe,1356
Kondakadalai Puli Vengaya Kuzhambu Recipe (South Indian Style Spicy And Tangy Kala Chana),1357
Jowar Bajra Garlic Roti Recipe,1358
Dal And Vegetable Kebab Recipe,1359
Shahi Bhindi Recipe in Cashew Nut Gravy - Okras in Cashew Nut Curry,1360
Kashmiri Style Nadru Yakhni Recipe-Lotus Stem in Yogurt Sauce,1361
Mughlai Bhindi Recipe - Spicy Okra Curry,1362
Lehsuni Methi Paneer Recipe - Garlic Methi Paneer Curry,1363
Chettinad Thakkali Vengaya Kuzhambu Recipe,1364
Foxtail Millet Khichdi Recipe with Batata Aloo Nu Shaak,1365
Pumpkin Dal with Garlic Tadka Recipe,1366
Bhindi Huli Recipe - South Indian Style Tangy Okra,1367
Ukad Recipe (Maharashtrian Rice Flour Porridge),1368
Rajasthani Dal Baaple Churma Recipe,1369
Goan Style Caldinho de Abobora Branca Recipe (Mild Curry of white Pumpkin),1370
Beans Karam Recipe (Beans Curry),1371
Indo Chinese Soya Stir Fry Recipe With Cashew Nuts,1372
Aava Pettina Majjiga Pulusu Recipe - Andhra Style Mor Kuzhambu,1373
Szechwan Hakka Noodle Momo Recipe,1374
Kathirikai UrulaiKizhanghu Pachidi Recipe (Brinjals And Potatoes With Moong Dal),1375
Masala Lachha Paratha Recipe,1376
Mangalorean Padengi Gassi Recipe - Green Moong Dal Curry,1377
Spicy & Masaledar Aloo Gobi & Beans Tawa Sabzi Recipe,1378
Maharashtrian Chavali Chi Usal Recipe - Black Eyed Peas Curry,1379
Patta Gobi Matar Nu Shaak Recipe (Cabbage & Peas Sabzi Recipe),1380
Chettinad Cauliflower Pepper Fry Recipe (Milagu Pirattal Poriyal),1381
Pasi Paruppu Masiyal Recipe-Green Moong Dal Curry Recipe,1382
Tomato Rice With Basil Recipe,1383
Udupi Style Alsande Kayi Saaru Recipe (Long Beans Gravy Recipe),1384
Awadhi Style Kathal Ke Kebab Recipe- Raw Jackfruit Kebabs,1385
Raw Papaya Kofta In Yogurt Curry Recipe,1386
Homemade Coconut Milk Recipe,1387
Goan Poee Recipe -  Delicious Whole Wheat Buns Recipe,1388
Arbi Tomato Onion Sabzi Recipe (Spicy Colocasia Stir fry),1389
आमला गवार फली की सब्ज़ी रेसिपी - Crispy Amla Gawar Phali Sabzi (Recipe In Hindi),1390
Gujarati Biraj Recipe - Saffron Flavored Sweet Lentil Rice With Dry Fruits & Coconut,1391
Matta Rice/ Chemba Rice Recipe-Pressure Cooker Method,1392
Mint Flavoured Mixed Vegetable Pulao Recipe,1393
Verusenaga Sambar Recipe (Fresh Groundnuts Sambar),1394
छोले पिंडी रेसिपी - Chole Pindi Recipe,1395
Baked Chinese Potato Recipe (Koorka Mezhukuperatti),1396
Subz Noor E Chashm Recipe (Nawabi Curry Recipe ),1397
कद्दू शिमला मिर्च की सब्ज़ी रेसिपी - Kaddu Simla Mirch Sabzi (Recipe In Hindi),1398
Khatte Baingan Recipe,1399
Chettinad Masala Powder Recipe,1400
Tomato Onion Gravy Sabzi Recipe,1401
Kelyachi Bhaji Recipe (Raw Banana Stir Fry),1402
Andhra Style Chama Dumpa Pulusu Recipe - Arbi With Sesame Tamarind Sauce Recipe,1403
Kasuri Methi Paneer Sabzi Recipe,1404
Karamani Poriyal Recipe - Yard Long Beans Stir Fry | Chawli | Barbati Sabzi,1405
Raw Papaya Mor Kootu Recipe - Ayurvedic No Onion No Garlic Recipe,1406
Oriya Kancha Kadali Bara Recipe (Raw Banana Cutlets),1407
भरमा बैंगन और प्याज की सब्ज़ी रेसिपी - Bharma Baingan Aur Pyaaz Ki Sabzi (Recipe In Hindi),1408
Karnataka Style Avarekalu Pulao Recipe - Avarekalu Pulao,1409
अमृतसरी दाल रेसिपी - Amritsari Dal (Recipe In Hindi),1410
Sprouted Horse Gram Thoran Recipe - No Onion No Garlic,1411
Creamy Dal Makhani Recipe,1412
Vaangi Shimla Mirchi Bhaji Recipe - Brinjal Capsicum Gravy,1413
Aloo Gobi Matar Ki Sabzi Recipe,1414
Banana And Ragi Porridge Recipe For Babies And Toddlers,1415
Dahi Ma Bheeda Recipe (Dahi Bhindi - Parsi Style Okras Cooked In Yogurt Recipe),1416
Gujarati Sev Tameta Nu Shaak | Sev Tamatar Ki Sabzi Recipe,1417
ब्रोकली और पेप्पर राइस रेसिपी - Broccoli & Pepper Rice (Recipe In Hindi),1418
Kaya Tholi Thoran Recipe (Raw Banana Thoran),1419
पटियाला आलू रेसिपी - Patiala Aloo Recipe,1420
Quinoa Brown Rice and Vegetable Pulao Recipe,1421
Quinoa and Vegetable Saute Recipe,1422
Paneer Do Pyaza Recipe,1423
Creamy Beetroot and Potato Puree Recipe - Baby Food,1424
हरी फली की सब्ज़ी रेसिपी - Green Beans Fry (Recipe In Hindi),1425
Ginger-Holy Basil Tisane - Adrak Tulsi Chai Recipe,1426
Tamil Nadu Style Potato Masiyal Recipe (South Indian Style Aloo Masala),1427
Cauliflower Pepper Fry Recipe (Chettinad Style),1428
Quinoa Vangi Bath Recipe,1429
Dhaba Style Dal Palak Recipe,1430
Kolhapuri Akkha Masoor Dal Recipe (Masoor Dal in Kholapuri Masala),1431
Aam Pora Shorbot Recipe - Bengali Aam Panna Recipe,1432
Cauliflower Coconut Milk Stew Recipe,1433
मूंग दाल मेथी की सब्ज़ी रेसिपी - Moong Dal Methi Ki Sabzi (Recipe In Hindi),1434
Spicy Soya Bhurji Recipe - North Indian Soya Matar Bhurji,1435
Bihari Style Kadhi Bari Recipe,1436
Sprouted Kollu Sambar Recipe - Horse Gram Sambar With Vegetables,1437
Goan Recheado Masala Recipe,1438
Milagu Keerai Poricha Kootu Recipe - Palak And Moong Dal Kootu,1439
Mushroom Tikka Masala Dry Recipe,1440
Honey Glazed Corn Fritters Recipe,1441
आलू पत्ता गोभी सब्ज़ी रेसिपी - Aloo Patta Gobi Sabzi Recipe,1442
Aam Ka Panna Recipe With Jaggery,1443
Thakkali Rasam Recipe - South Indian Tomato Rasam,1444
गुजराती दाल रेसिपी - Gujarati Dal (Recipe In Hindi),1445
Achari Baingan Bharta Recipe,1446
Carrot and Capsicum Mix Dal Recipe,1447
Baked Whole Wheat Masala Baati Recipe (Healthy Rajasthani Spiced Wheat Dumplings),1448
टमाटर रसम रेसिपी - Tomato Rasam (Recipe In Hindi),1449
Mixed Vegetable Paratha Recipe,1450
Uttarakhand Aloo Ke Gutke Recipe,1451
Kanda Keri Nu Kachumber Recipe- Instant Mango Pickle,1452
Aloo Posto Recipe (Potatoes In Poppy Seed Paste),1453
Traditional Whole Gobi Musallam Recipe,1454
Dhingri Matar Recipe (Mushrooms and Peas Spicy Curry),1455
Spiced Buttermilk With Coriander And Ginger Recipe,1456
चेट्टिनाड मसाला पाउडर रेसिपी - Chettinad Masala Powder Recipe,1457
Stove Top Green Peas Seekh Kebab Recipe,1458
Bharwa Besan Mirch Sabzi Recipe - Chillies Stuffed With Spiced Gram Flour,1459
वन पॉट पंजाबी राजमा मसाला रेसिपी - One Pot Punjabi Rajma Masala Recipe,1460
Sundakkai And Methi Leaves Sambar Recipe,1461
Nigella Seed Beetroot Rice Recipe,1462
हरा चना मसाला रेसिपी - Hara Chana Masala (Recipe In Hindi),1463
Mambazha Mor Kuzhambu Recipe - Ripe Mango Mor Kuzhambu,1464
Bengali Style Shaak Bhaja Recipe (Stir Fried Green Amaranth leaves Recipe),1465
Konkani Style Southe Koddel Recipe-Mangalore Cucumber in Coconut curry,1466
कुर्ग स्टाइल मशरुम करी रेसिपी - Coorg Style Mushroom Curry Recipe,1467
Tambdi Bhaji Recipe - Goan Style Red Amaranth Stir Fry,1468
Honey and Sesame Tossed Flat Noodles with Toasted Tofu Recipe,1469
Quick Beetroot Pulao Recipe,1470
Matki Khichdi Recipe - Palak Pudina Moth Bean Khichdi Recipe,1471
Chunni Ki Puri Recipe - Moong Dal And Besan Fried Puri Recipe,1472
Tamil Nadu Style Arachuvitta Rasam Recipe,1473
Goan Style Sangacho Ross Recipe-Drumstick Curry,1474
Aloo Matar Korma Recipe In White Gravy,1475
Aavryachi Bhaji-Avarakkai Poriyal Recipe-Broad Beans Stir Fry,1476
तमिल नाडु स्टाइल सोरकई पोरियल - Spicy Dry Bottle Gourd (Recipe In Hindi),1477
Stuffed Ridge Gourd Recipe,1478
No Onion No Garlic Aloo Makhana Sabzi Recipe,1479
Nimki Aloo Anardana Curry Recipe - Potato And Nimki Curry,1480
Thekera Tenga Recipe,1481
Konkani Style Kotte Saaru/Halasina Bijada Saru Recipe-Jackfruit Seed Rasam,1482
"Kashmiri Pulao Recipe - Pulao Spiced With Saffron, Whole Spices & Nuts",1483
Poricha Kuzhambu Recipe (Tamil Nadu Style Mixed Vegetables and Lentil Stew),1484
मसूर दाल मखनी रेसिपी - Masoor Dal Makhani (Recipe In Hindi),1485
Bihari Kale Chane Ki Ghugni Recipe,1486
Lauki Bharta Recipe - Spiced & Mashed Bottled Gourd Recipe,1487
Smoked Dhaba Dal Recipe,1488
Mambhazam Pulissery Recipe,1489
Raw Jackfruit Biryani Recipe - Kathal Biryani,1490
Kabuli Chana Kofta Biryani Recipe - Chickpea Kofta Biryani,1491
Curry Fried Quinoa Rice Recipe,1492
Bihari Style Aloo Ka Chokha Recipe - Spiced & Mashed Potatoes With Mustard Oil,1493
Khatte Chole Recipe - A Delicious North Indian Chana Masala,1494
Besan Capsicum Ki Sabzi Recipe,1495
Mooga Gathi (Sprouted Moong In Coconut Paste) Recipe,1496
Maharashtrian Green Moong Bhat Recipe - Sprouted Green Moong Pulao,1497
Shimla Mirchi Panchamrut Recipe | Konkani Capsicum Cashew Peanut Sabzi,1498
Bhey Vangan Saag Recipe - Sindhi Style Lotus Stem Spinach Brinjal Sabzi,1499
Chena Kaya Erissery Recipe,1500
Karela Thepla Recipe - Bitter Gourd Indian Flat Bread,1501
Thavala Adai Recipe,1502
Achari Paneer Mini Bread Bowl With Cheesy Twist Recipe,1503
Mooli Jowar Ki Roti Recipe - Mullangi Kambu Chapathi,1504
Bengali Sukto Recipe - Mixed Vegetable Curry,1505
Tomato Rasam Recipe For Babies And Toddlers,1506
Vegetarian Momo Recipe-Steamed Dumplings/A Street Food from the North East India,1507
Capsicum Bath Recipe,1508
Watermelon Seeds Rice Recipe,1509
Homemade Multigrain Baby Cereal Recipe (Baby Porridge),1510
Palak Patta Chaat Recipe-Delhi style Spinach leaf Chaat,1511
Hariyali Gobi Recipe - Palak Cauliflower Curry Recipe,1512
Mulakootal (Vegetables In Coconut Gravy) Recipe,1513
Manga Rasam Recipe - Raw Mango Rasam Recipe,1514
Oriya Special Dalma Recipe - Lentils Cooked With Vegetables & Raw Papaya,1515
Tamil Nadu Style Pala Kottai Sambar Recipe - Mangalore Cucumber & Jackfruit Seed Sambar,1516
Cucumber Mor Kuzhambu Recipe (Cucumber Curry),1517
Andhra Style Beerakaya Pappu Recipe (Ridge Gourd Dal Recipe),1518
Sorakkai Kozhukattai Paal Kuzhambu Recipe - Bottle Gourd Curry,1519
Sweet And Sour Vegetables Recipe,1520
Turai Baingan Ki Sabzi Recipe - Eggplant Ridge Gourd Sabzi,1521
Vaangi Bhaat Recipe (Maharashtrian Style Brinjal Rice),1522
Cauliflower And Red Bell Pepper Stir Fry Recipe,1523
Manga Ogre Recipe (Mango Rice),1524
Pepper Cauliflower Recipe,1525
Daal Pithi Recipe,1526
Kashmiri Style Nadru Ke Kabab Recipe-Lotus Stem in Spicy Gravy,1527
Peanut Rice With Coconut Recipe,1528
Green Peas Nimona Recipe,1529
Uttarakhand Style Black Gram Chainsoo Recipe,1530
Aloo Matar Paneer Curry Recipe,1531
Multigrain Crepe Recipe Filled With Spicy Mashed Potatoes,1532
Sindhi Sai Bhaji Recipe - Wholesome Sindhi Dal With Vegetables,1533
Red Capsicum Poriyal Recipe - Red Bell Pepper Stir Fry,1534
खट्टे पुदीना आलू रेसिपी - Khatte Pudina Aloo Recipe,1535
Moong Bean Sprouts Upkari Recipe - Moong Beans Stir Fry,1536
Drumstick Dal Soup Recipe,1537
Cauliflower Matar Bhurji Recipe,1538
Mixed Sprouts In Chettinad Masala Recipe,1539
Homemade Rice Cereal Recipe (Babies-4 months onward),1540
आलू मेथी की सब्ज़ी रेसिपी - Potato Fenugreek Leaves Stir Fry (Recipe In Hindi),1541
Vegetable Yakhni Pulao Recipe,1542
Broccoli Puree With Butter and Garlic Recipe (For Babies/toddlers over 7 months),1543
गवार फली मसाला सब्ज़ी रेसिपी - Gawar Phali Masala Sabzi Recipe,1544
Carrot Methi Pachadi Recipe,1545
Palak Makhana Recipe (Navratri Fasting/Vrat Recipe),1546
Mavinakayi Gojju Recipe - Mango Curry,1547
Sindhi Bhuga Chawal Recipe - Sindhi Style Browned Rice Pulao,1548
Tofu Green Pulao Recipe,1549
Dal Bukhara Recipe (Punjabi Style Black Urad Dal),1550
Rabodi Ki Sabzi Recipe,1551
Raw Mango Thokku Recipe - Tamil Nadu Style Raw Manga Thokku,1552
Andhra Gongura Pulihora Recipe | Gongura Puliyodharai | Spicy Red Roselle Leaves Rice,1553
पनीर बिरयानी रेसिपी - Paneer Biryani Recipe,1554
Stir Fried Brown Rice And Wild Rice Topped With Honey-Glazed Tofu Recipe,1555
नवाबी मिक्स्ड वेजिटेबल रेसिपी - Nawabi Mixed Vegetable Gravy (Recipe In Hindi),1556
Moong Dal Methi Ki Sabzi Recipe,1557
बैंगन मुसल्लम रेसिपी - Mughlai Style Eggplant Simmered In Rich Tomato Curry (Recipe In Hindi),1558
Baked Gobi Manchurian Recipe - Healthy Cauliflower Manchurian Recipe,1559
Hyderabad Style Kuska Recipe (Biryani Rice Recipe),1560
पालक तम्बूली रेसिपी - Palak Tambuli (Recipe In Hindi),1561
किरई सांबर रेसिपी - Keerai Sambar (Recipe In Hindi),1562
Munthiri Masala Kurma Recipe - Kaju Masala Kurma Recipe,1563
नेलिकई रसम रेसिपी - Amla Rasam Recipe,1564
Kerala Special Vegetable Stew Recipe,1565
बिहारी स्टाइल आलू का चोखा रेसिपी - Bihari Style Aloo Ka Chokha Recipe,1566
अमृतसरी सूखी दाल रेसिपी - Amritsari Sookhi Dal Recipe,1567
Senai Kizhangu Poriyal Recipe-Yam Poriyal Recipe,1568
दाल पालक रेसिपी - Dal Palak (Recipe In Hindi),1569
Baingan Bharta Recipe - Smoked Roasted Eggplant with Green Chillies and Ginger,1570
Badanekaayi Gojju (Brinjal Curry) Recipe,1571
पत्ता गोभी पुलाव रेसिपी - Spiced Cabbage Rice (Recipe In Hindi),1572
बंगाली स्टाइल छोलार दाल रेसिपी - Bengali Style Cholar Dal (Recipe In Hindi),1573
Kashmiri Style Al Rogan Josh Recipe- Pumpkin In Red Curry,1574
गोबी और सोया कीमा रेसिपी - Gobi and Soya Keema Recipe,1575
Fried Barnyard Millet Recipe -Fried Samvat Rice,1576
Grilled Paneer Methi Tikki Recipe,1577
Thotakura Pappu Recipe (Toor Dal with Amaranth Leaves),1578
Murunga Keerai Urula Poriyal Recipe - Moringa Aloo Sabzi,1579
Vazhaithandu Lemon Rasam Recipe - Banana Stem Lemon Rasam,1580
अालुची भाजी - Aluchi Bhaji (Recipe In Hindi),1581
पत्तागोबी थोरन रेसिपी - Cabbage Thoran (Recipe In Hindi),1582
आंध्रा स्टाइल वांकाया कोथिमीरा करम रेसिपी - Andhra Style Vankaya Kothimeera Karam Recipe,1583
बंगाली फूल गोभीर पतुरी रेसिपी - Bengali Phool Gobhir Paturi (Recipe In Hindi),1584
Carrot And Coriander Soup Recipe,1585
Goan Tendli Bhaji Recipe,1586
Milagu Kozhambu Recipe,1587
Kondakadalai Vazhathandu Puli Thengai Kuzhambu Recipe (Banana Stem Curry with Black Chickpeas Recipe),1588
पत्ता गोभी कोफ्ता करी रेसिपी - No Onion No Garlic Cabbage Kofta Curry,1589
Rajma Saagwala (Dry Kidney Beans And Spinach Stir Fry) Recipe,1590
पकोड़ी कूरा रेसिपी - Pakodi Koora (Recipe In Hindi),1591
Beetroot Thoran Recipe,1592
बूंदी और हरे प्याज की सब्ज़ी रेसिपी - Boondi And Spring Onion Greens Sabzi (Recipe in Hindi),1593
Soya Chunk And Green Peas Sabzi Recipe,1594
पोटाला रसा रेसिपी - Oriya Style Parval Sabzi (Recipe In Hindi),1595
Haryali Seekh Kebab Recipe,1596
Pineapple Gojju Recipe (Karnataka Style Tangy And Spicy Pineapple Curry),1597
Achari Paneer Recipe -Spicy Pickled Paneer Gravy,1598
नवाबी कोफ्ता करी रेसिपी - Nawabi Kofta Curry Recipe,1599
Besan & Atta Ki Roti Recipe (Chickpea Flatbread),1600
Ingi Mangai Sadam Recipe,1601
मुल्तानी काली अरबी रेसिपी - Multani Kaali Arbi (Recipe In Hindi),1602
Methi Malai Paneer Recipe,1603
Sweet & Spicy Pineapple Pani Puri Recipe,1604
Carrot Beans Thoran Recipe - Kerala Thoran For Onam Sadya,1605
Aloo Methi Masala Recipe - Potato & Fenugreek Leaves Gravy,1606
मूगा गाथि रेसिपी - Mooga Gathi (Recipe In Hindi),1607
परवल मसाला रेसिपी - Parwal Masala Recipe,1608
Bhaat Na Rasawala Muthia Dhokla Recipe | Gujarati Rasiya Dhokla,1609
Broccoli Paratha Recipe,1610
Drumstick Leaves Kadhi Pakora Recipe - Moringa Kadhi Pakora,1611
Bandhakopir Ghonto Recipe (Bengali Style Cabbage Fry),1612
Pumpkin Kofta Curry Recipe,1613
Suran Ki Sabzi Recipe - Jimikand Masala Sabzi Recipe,1614
Andhra Style Mukkala Pulusu Recipe-Sweet Tangy Vegetable Stew,1615
बदनेकाई गोज्जु रेसिपी - Badanekaayi Gojju Recipe,1616
अरबी का साग रेसिपी - Arbi Ka Saag (Recipe In Hindi),1617
Corn Chilli Cheese Momos Recipe,1618
Methi Pakoda Kadhi Recipe - Punjabi Kadhi Pakora,1619
Hurali Saaru Recipe - Healthy Horse Gram and Coconut Curry,1620
Punjabi Style Spicy Arbi Sabji Recipe,1621
Mint Vegetables Moilee Recipe (Mixed Vegetables Cooked In Minty Coconut Milk),1622
Amla Achaar Recipe | Hot & Sweet Indian Gooseberry Pickle,1623
Mushroom Thoran Recipe-Kerala Style Mushroom Sabzi,1624
होल वीट लच्छा पराठा रेसिपी - Whole Wheat Lachha Paratha Recipe,1625
Moong Dal Rasam/Pesara Pappu Charu Recipe (Lemon Infused Indian Lentil Soup),1626
Karnataka Style Avarekalu Sagu Recipe-Hyacinth Beans/ Mochai Kurma,1627
Sindhi Toor Dal Recipe With Aam Papad - Aam Papad Dal Recipe,1628
Maharashtrian Style Bhogichi Bhaji Recipe - Mixed Vegetable Curry,1629
Goan Masoorchi Usali Recipe (Black Lentil Stir Fry),1630
Rajasthani Sweet & Spicy Ker Sangri Sabzi Recipe,1631
Chana Dal Pulao Recipe,1632
Ellu Kuzhambu Recipe- Sesame Seeds Kuzhambu,1633
Kumbakonam Kadappa Recipe - South Indian Style Lentil and Potato Stew,1634
Potala Rasa Recipe (Oriya Style Parval Sabzi),1635
Chatpata Baby Potato Recipe,1636
आलू परवल की सुखी सब्ज़ी रेसिपी - Potato And Pointed Gourd Sabzi (Recipe In Hindi),1637
Kerala Style Whole Wheat Parotta Recipe,1638
Masaura And Potato Tarkari Recipe,1639
Soya Chunks And Beetroot Biryani Recipe,1640
Kollu Puli Kuzhambu Recipe - Horsegram In A Tangy Gravy,1641
Khatta Meetha Tamatar Sabzi Recipe - A Chutney Style Dry Sabzi,1642
Aloo Paneer Kebab Recipe,1643
Masoor Dal Kebabs Recipe,1644
