RecipeName,0
टमाटर पुलियोगरे रेसिपी - Spicy Tomato Rice (Recipe In Hindi),0
Udupi Style Ash Gourd Coconut Curry Recipe,1
Andhra Style Ingavu Chaaru Recipe - Asafoetida Flavored Tamarind Rasam,2
Saunf Aloo (Fennel Potato Curry) Recipe,3
चेट्टिनाड वेजिटेबल पुलाव रेसिपी - Chettinad Vegetable Pulao Recipe,4
Mini Dal Samosa Curry/Sabzi Recipe,5
Mini Dal Pakwan Chaat Recipe - A Perfect Party Snack,6
सुंडकई मेथी सांबर रेसिपी - Sundakkai And Methi Leaves Sambar Recipe,7
Kodava Mudi Chekke Barthad Recipe - Raw Jackfruit & Black Chickpea Stir Fry,8
Whole Wheat Crepe Recipe With Herbed Vegetables,9
Makki and Methi Roti Recipe,10
Cabbage and Carrot Sambharo Recipe - Gujarati Vegetable Stir Fry,11
Rajasthani Khooba Roti Recipe,12
Chanar Dalna Recipe -Bengali Style Paneer & Potato Gravy,13
Bengali Mooli Aloo Ki Sabzi  Recipe,14
चकुंदर सांबर रेसिपी - Beetroot Sambar (Recipe In Hindi),15
टोफू पुलाव रेसिपी - Tofu Pulao (Recipe In Hindi),16
Dubuk Vade Recipe - Khandeshi Gram Flour Dumpling Curry,17
Matar Paneer Kachori Korma Recipe - Green Peas And Paneer Kachori Curry,18
Thengai Sadam Recipe (A Quick and Healthy Coconut Rice),19
Karwar Style Ambade Udid Methi Recipe - Hog Plum Curry,20
Roasted Cauliflower Recipe,21
Crunchy Ginger Capsicum Rice Recipe,22
White Pumpkin Mor Kuzhambu Recipe - Kerala Style White Pumpkin Curry,23
पनीर बटर मसाला बिरयानी रेसिपी - Layered Paneer Butter Masala Biryani Recipe,24
कोब्बारी चारु रेसिपी - Kobbari Chaaru Recipe,25
Appalam Vatha Kuzhambu Recipe - Papad In Tamarind Gravy,26
Kashmiri Style Modur Pulao With Pomegranate Recipe,27
North Indian Style Mushroom Matar Masala Recipe,28
Dhania Chole Masala Recipe - Chickpeas In Fresh Coriander Gravy,29
शिमला मिर्च मसाला पोरियल रेसिपी - Capsicum Masala Poriyal (Recipe In Hindi),30
केरला स्टाइल कच्चा केला और सुरन कोटु करी रेसिपी - Kerala Style Plantain & Yam Thoran Recipe,31
Dahi Wale Paneer Recipe - Paneer In A Curd Gravy,32
Pudina Mushroom And Soya Biryani Recipe,33
Lauki Ka Salan Recipe - Bottle Gourd Salan Recipe,34
Togari Bele Tovve Recipe  - Toor Dal Rasam,35
Mushroom Paratha Recipe,36
Palak Chana Dal Recipe - Healthy Spinach Gram Dal Recipe,37
Pasi Paruppu Kosumalli Recipe (Spiced Lentil Salad Recipe),38
Ragi Masala Roti Recipe,39
Paneer Matar Butter Masala (Indian Cottage Cheese and Peas Masala With Butter) Recipe,40
Thandu Keerai Puli Kuzhambu Recipe - Amaranth Greens in Tangy Curry,41
माँ की दाल रेसिपी - Maa Ki Dal (Recipe In Hindi),42
Palak Mushroom Makhani Recipe - Creamy Spinach & Mushroom,43
Dahi Bhalla Papdi Chaat Recipe,44
छोले मसाला रेसिपी - Dry Masala Chickpeas (Recipe In Hindi),45
व्रत वाले आलू पनीर रेसिपी - Potato Paneer Curry Without Onion And Garlic Recipe (Recipe In Hindi),46
कटाची आमटी रेसिपी - Katachi Amti (Recipe In Hindi),47
गोभी मटर की भुर्जी रेसिपी - Cauliflower Matar Bhurji (Recipe In Hindi),48
Kashmiri Style Paneer Masala Recipe,49
Aromatic Vegetable Pulao Recipe,50
One Pot Spicy Vegetable Pulao Recipe with Coconut Milk,51
बंगाली आलू दम रेसिपी - Bengali Aloo Dum Recipe,52
Hyderabad Soy Biryani Recipe With Vegetables & Palak,53
साउथ इंडियन पापड करी रेसिपी - Appalam Vathal Kuzhambu (Recipe In Hindi),54
Moong Dal Khichdi Recipe For Babies And Toddlers Over 10 Months,55
Dahi Wale Aloo Recipe (Indian Yogurt-based Potato Curry),56
Kovakkai Podi Curry Recipe - Tamil Nadu Style Ivy Gourd Stir Fry,57
बिरयानी मसाला पाउडर रेसिपी - Biryani Masala Powder Recipe,58
Andaman Style Steamed Garlic Prawns Recipe,59
Aloo Matar Masala Khichdi Recipe,60
Potato Vindaloo Recipe (Spicy Goan Potato Curry),61
Aloo Potol Posto Recipe (Aloo Parwal in Poppy Seed Masala Recipe),62
Aloo Bhey Ki Sabzi Recipe (Potato Lotus Stem Curry),63
Baingan Sarson Ka Saag Recipe,64
पनीर भरमा भिन्डी रेसिपी - Stuffed Bhindi With Paneer (Recipe In Hindi),65
Bael Ka Sharbat Recipe - Wood Apple Squash Drink,66
Safed Achari Baingan Recipe - White Aubergine in pickled spices,67
Jodhpuri Aloo Recipe,68
Vendakkai Thoran Recipe - Kerala Style Bhindi Stir Fry,69
Chana Aur Aloo Ki Sookhi Sabzi Recipe,70
बैंगन सरसों का साग रेसिपी - Baingan Sarson Ka Saag Recipe,71
Stuffed Arbi Paratha Recipe,72
Bengali Cholar Dal Recipe,73
हैदराबादी वेजिटेबल बिरयानी रेसिपी - Hyderabadi Vegetable Biryani Recipe,74
Baby Corn Cigar Recipe,75
Gehu Bajra Thepla Recipe - Bajra Masala Paratha,76
Aam Panna Pani Puri Recipe,77
Lentils and Mixed Grains Kichada Recipe,78
Dhania Wale Aloo Recipe - Coriander Potato Dry,79
राजस्थानी घसेला रेसिपी - Besan Ka Pitta (Recipe In Hindi),80
Andhra Style Vendakaya Charu Recipe - Ladies Finger Rasam,81
पालक पनीर भुर्जी रेसिपी - Palak Paneer Bhurji Recipe,82
Till Wale Aloo Recipe - Sesame Potato Sabzi,83
Sweet & Spicy Stuffed Paneer In Kofta Curry Recipe,84
Spicy Baby Potatoes Recipe,85
Andhra Style Palakura Pappu Recipe (Spinach Dal Recipe),86
हुनासे गोज्जु रेसिपी - Hunase Gojju Recipe,87
Kaigari Pirattal Recipe (Chettinad Style Mixed Vegetables),88
Spicy Paneer Bhurji Pav Sandwich Recipe - Breakfast Recipe,89
फालगुनी दाल रेसिपी - Phalguni Dal (Recipe In Hindi),90
Gawar Phali Masala Sabzi Recipe - Cluster Beans Gravy Sabzi,91
Moringa Masoor Dal Recipe - Drumstick Leaves Dal,92
Rajasthani Gatte Ki Sabzi Recipe With Onion & Garlic,93
Bengali Aloo Potol er Dalna Recipe - A Traditional Vegetable Side Dish,94
One Pot Methi Mushroom Brown Rice Pulao Recipe,95
Veg Mughlai Paratha Recipe,96
Andhra Style Palakaru Vepadu Recipe - Spinach Stir Fry Recipe,97
Paka Kela Ki Sabzi Recipe | Paka Kela nu Shaak | Gujarati Jain Recipe,98
नवरंग दाल रेसिपी - Navrang Dal (Recipe In Hindi),99
चाउ चाउ सांबर रेसिपी - Chow-Chow Sambar (Recipe In Hindi),100
Kurkuri Bhindi With Spicy Tomato Yogurt Gravy Recipe,101
No Onion No Garlic Lobia Masala Recipe In Electric Pressure Cooker,102
Instant Puliyodharai Powder Recipe (Puliyogare/Pulihora Powder),103
Vendakka Stew Recipe (Kerala Style Okra Stew),104
Chilke Wali Mung Dal Curry Recipe,105
मसूर दाल गस्सि रेसिपी - Masoor Dal Gassi Recipe,106
Potato Stuffed Dal Dhokli Recipe,107
Paneer In Coconut Gravy Recipe,108
गोअन पोई रेसिपी - Goan Poee Recipe,109
Potato Paneer Curry Without Onion And Garlic Recipe (Vrat Wale Aloo Paneer),110
Fansi Muthia Nu Shaak Recipe - Green Beans With Gram Flour Dumplings,111
केरला स्टाइल अप्पम रेसिपी - Kerala Style Appam Recipe,112
Khatta Meetha Petha Recipe (Yellow Pumpkin Sabzi),113
Mixed Sprouts Sabzi Recipe,114
तुलसी और पान के पत्तो का रसम रेसिपी - Tulsi And Betel Leaves Rasam Recipe,115
Chickpea Coconut Milk Curry Recipe,116
Sweet Potato Dal Recipe,117
Bihari Shakarkand Bhujiya Recipe - Spicy Sweet Potato Sabzi,118
सेब और टमाटर की सब्ज़ी रेसिपी - No Onion No Garlic Spiced Apple Tomato Curry (Recipe In Hindi),119
Stuffed Gilka Recipe (Maharashtrian Style Stuffed Silk Squash),120
Murungai Keerai Rasam Recipe,121
पालक पनीर रेसिपी - Palak Paneer Recipe,122
Kurkure Karela Sabzi Recipe - Crispy Karela Bhujiya,123
वेपमपू राइस रेसिपी - Dried Neem Flower Flavoured Rice (Recipe In Hindi),124
Broccoli And Aloo Poriyal Recipe - South Indian Broccoli And Potato Stir Fry,125
Nendra Pazham Pulissery Recipe - Ayurvedic Recipe,126
लौकी बड़ी की सब्ज़ी - Lauki Badi Ki Sabzi (Recipe In Hindi),127
फूलकोपीर पतुरी रेसिपी - Fulkopir Paturi Recipe,128
Karnataka Special Huli Tovve Recipe,129
Lehsuni Tikki Recipe,130
Hyderabadi Chand Biscuits Recipe,131
गाजर पुलाव रेसिपी - Carrot Rice (Recipe In Hindi),132
Pumpkin Peas Palya Recipe,133
Paneer Satay Recipe,134
Poosanikai Rasavangi Recipe - Ash Gourd Curry With Dal,135
Malvani Vatli Dal Recipe,136
Chettinad Vengaya Kosu Recipe (Spicy Curry from Chettinad Cuisine),137
Meethe Chawal Recipe - Zarda Pulao,138
Navratan Korma Recipe,139
चावल बनाने की विधि रेसिपी - Steamed Rice Recipe,140
Tarkari Ni Kari Recipe (Parsi Style Vegetable Curry),141
Nepalese Style Dhal Bhat Recipe,142
Murungakkai Mor Kuzhambu Recipe-Drumstick Buttermilk Curry,143
Parsi Style Lagan Sara Istew Recipe - Rich Sweet Assorted Vegetable Curry,144
Mixed Beans Vegetable Pulao Recipe,145
Odiya Style Chana Dal With Potato & Pumpkin Curry Recipe,146
Makhana ki Sabzi Recipe,147
Szechuan Vegetarian Fried Rice,148
Achari Gobi Shimla Mirch Ki Sabzi Recipe - Capsicum And Cauliflower Sabzi,149
Chole Biryani Recipe - Spicy Chana Biryani  Recipe,150
Rajgira Paneer Paratha Recipe (Navratri Fasting/Vrat Recipe),151
Tandoori Potatoes Recipe,152
केरला स्टाइल अरबी की सब्ज़ी रेसिपी - Kerala Style Arbi Curry,153
छोले शिमलामिर्च मसाला रेसिपी - Chole Capsicum Masala Recipe (Recipe In Hindi),154
गाजर और शिमला मिर्च पुलाव रेसिपी - Carrot And Capsicum Rice (Recipe In Hindi),155
Senai Kizhangu Varuval Recipe - Spicy Chettinad Style Yam Stir Fry,156
गवारफली की सुखी सब्ज़ी रेसिपी - Gavarfali Ki Sukhi Sabzi (Recipe In Hindi),157
मुलांगी करी रेसिपी - Mullangi Curry (Recipe In Hindi),158
Kakdi Chi Koshimbir Recipe - Maharashtrian Style Cucumber Salad,159
Shepuchi Bhaji Recipe (Stir Fried Maharashtrian Suva/Dill Greens),160
नवाबी पनीर करी रेसिपी - Nawabi Paneer Curry Recipe,161
पालक पुलाव रेसिपी - Palak Pulao (Recipe In Hindi),162
वेजीटेरियन हक्का नूडल्स रेसिपी - Vegetarian Hakka Noodles Recipe,163
Thalicha Thayir Sadam Recipe - Spicy Seasoned Curd Rice,164
Marwadi Gatte Ki Kadhi Recipe - Gram Flour Dumpling In Yogurt Curry,165
Kashmiri Style Bharit Marchavangun Recipe-Stuffed Chillies,166
Mushroom Caldine Recipe | Vegetarian Goan Mushroom Curry,167
Konkani Style Maskasangi Magge Koddel Recipe-Drumstick and Mangalore Cucumber Curry,168
Bengali Style Cholar Dal Recipe-Chana Dal,169
Aamras Ki Kadhi Recipe - Mango Kadhi Recipe,170
Pavakka Theeyal Recipe - Spicy & Tangy Karela In Tamarind Gravy,171
Smoked Tandoori Paneer Tikka Recipe,172
Khatti Meethi Tindora Sabzi Recipe - Gujarati Tindora Nu Shaak,173
Lilve Ki Sabzi Recipe (Green Chickpea Curry),174
Amaranth Leaves Khichdi Recipe,175
मसाला रोटी रेसिपी - Masala Roti (Recipe in Hindi),176
Maakhmi Dal Recipe-Sindhi Style Moong Dal,177
Sorekai Majjige Huli Recipe (Bottle Gourd In Coconut Yogurt Curry Recipe),178
Paneer Matar Keema Recipe,179
Palak Onion Kadhi Pakora Recipe,180
नवरतन कोरमा (सूखा) रेसिपी - Dry Navratan Korma (Recipe In Hindi),181
Turai Pyaz Hari Mirch Ki Sabzi Recipe-Ridge Gourd Stir Fry With Green Chili And Onions,182
Konkani Style Vengaya Sagle Recipe - Eggplant Drumstick Curry,183
Keri Na Gotla Nu Shaak Recipe - Gujarati Style Ripe Mango Curry,184
Tomato Kurma Recipe - Thakkali Kurma For Biryani & Parotta,185
Maa Ki Dal Recipe - Punjabi Style Black Urad Dal Recipe,186
Onion Thepla Recipe,187
Cauliflower Thoran Recipe (Kerala Style Cauliflower),188
Nellor Kathirikai - Nellor Brinjal Fry Recipe,189
Bharwa Lauki Recipe In No Onion No Garlic Makhani Gravy,190
Kiwi Guava Spritzer Recipe,191
Soya Chunks Masala in Coconut Milk Recipe,192
Drumstick Leaves Sabzi With Crushed Peanuts Recipe,193
Doddapatre Soppina Chitranna Recipe (Spiced Indian Thyme Rice),194
Coriander Semiya Recipe - Vermicelli Pulao,195
Dal Dhokli Recipe With Sprouted Moong Dal,196
Ragi Sankati Recipe - Andhra Style Ragi Mudda,197
Sukhe Chole Recipe - Dry Masala Chickpeas,198
Kadhai Tofu Sabji Recipe,199
Jeera Milagu Rasam Recipe  - South Indian Pepper Cumin Rasam,200
Karnataka Style Orange Peels Curry Recipe,201
Kerala Style Chakka Pal Kozhukattai Recipe-Rice Dumpling In Jackfruit flavored Coconut Milk,202
Dhaba Style Tawa Pulao Recipe - Masala Brown Rice Tawa Pulao,203
Kadai Broccoli Masala Recipe - Broccoli Cooked With Indian Spices,204
Chana Methi Dal Recipe - Fenugreek & Split Bengal Gram Curry,205
Baked Fish In Coconut Milk Recipe,206
Kashmiri Monj Haakh Recipe - Knol Khol Flavored With Asafoetida,207
Bharwa Karela With Sweet Potato Filling Recipe,208
Kerala Cherupayar Curry Recipe (Green Moong and Yellow Moong Dal Recipe),209
Kathiri Urulai Masala Kuzhambu Recipe - Brinjal And Potato Masala Gravy,210
Saragva Nu Shaak Recipe-Drumstick Masala Sabzi,211
Bihari Aloo Bhujiya Recipe,212
Kohlrabi Recipe (Knol Khol Poriyal),213
Mixed Millet Khichdi Recipe,214
Chironji Ki Dal Recipe,215
Sarson Saag Pulao Recipe-Spinach Mustard Greens Pulao,216
Milagu Rasam Recipe - Village Style Pepper Rasam,217
Saoji Methi Pulao Recipe - Maharashtrian Style Fenugreek Leaves Pulao,218
Parsi Style Sekta Ni Sing Recipe-Sweet & Spicy Drumsticks Cooked In Coconut Water/Toddy Recipe),219
Maharashtrian Style Kothimbir Oats Vadi Recipe,220
Chana Dal Khichdi Recipe,221
Boti Masala Chaat Recipe - Fryums Chaat  Recipe,222
Matar Ki Tehri Recipe - Fragrant rice cooked with spices and fresh peas,223
Mullangi Mor Pachadi Recipe (Radish in spicy tempered Yogurt Gravy Recipe),224
Mangalorean Style Bafat Pito Recipe-Bafat/Bafad Spice Mix Powder,225
Andhra Style Vegetarian Biryani with Soya Chunks Recipe,226
Kerala Style Vendakka Uppadan Recipe,227
Sweet & Spicy Ripe Mango Curry Recipe,228
Poondu Milagu Kuzhambu Recipe - Tamilnadu Style Garlic and Black Pepper Curry,229
Goan Style Brinjal Bharta Recipe,230
Odia Chatu Besara Recipe (Mushrooms in Spicy Mustard Curry),231
Corn And Peas Curry Recipe,232
काला वटाना आमटी रेसिपी - Kala Vatana Amti (Recipe In Hindi),233
Sprouted Moong Dal Recipe - Spicy Sprouted Lentil Curry,234
Kerala Style Taroo Root Curry Recipe (Colacasia),235
Chutney Podi Sadam Recipe - Rice Flavoured With Chutney Podi,236
चटपटा आलू रेसिपी - Chatpata Baby Potato (Recipe In Hindi),237
Rase Wale Aloo Recipe (Boiled Potato in Tangy Tomato Sauce),238
वेपमपू करा कोलंब रेसिपी - Vepampoo Kara Kuzhambu Recipe,239
Bell Pepper Sabji Recipe-No Onion No Garlic,240
Omakka Curry Recipe - Kerala Style Papaya Curry,241
Dal Tadka Recipe Flavored with Lemon and Coriander,242
Chettinad Beans & Cauliflower Poriyal Recipe (South Indian Stir Fry),243
Healthy Fulkopir Paturi Recipe (Bengali Style Cauliflower Dumplings),244
Dal Banjara Recipe - Langar Wali Dal,245
Zucchini Keerai Thogayal Recipe - South Indian Tangy Spinach and Zucchini Chutney,246
Veppam Poo Rasam Recipe (Neem flower Rasam),247
Odia Style Chuin Aloo Besara Recipe-Potato & Drumsticks Fry In Mustard Paste,248
गोअन मसूरची उसली रेसिपी - Goan Masoorchi Usali (Recipe In Hindi),249
Tawa Mushroom Recipe,250
Besan Aur Mirch Ki Sabzi Recipe,251
Kerala Special Mambazha Puliserry Recipe,252
Patiala Aloo Recipe,253
Kongunadu Style Vetrilai Sadam Recipe - Betel Leaves Rice,254
लौकी भरता रेसिपी - Lauki Bharta (Recipe In Hindi),255
गोअन काजू करी रेसिपी - Goan Kaju Curry Recipe,256
लाहोरी आलू रेसिपी - Lahori Aloo (Recipe In Hindi),257
Lemongrass Coconut Rice Recipe,258
शिमला मिर्च पनीर भुर्जी रेसिपी - Paneer Bhurji Recipe With Capsicum (Recipe In Hindi),259
Chilli Baby Corn (Manchurian) Recipe,260
गोअन चना रोस रेसिपी - Goan Chana Ros (Recipe In Hindi),261
कवाती रेसिपी - Nepali Beans Soup (Recipe In Hindi),262
Thalipeeth Bhajani Recipe -Typical Maharashtrian Multigrain Flour Mix,263
Avarekaalu Usli (Broad Bean In Gravy) Recipe,264
Bhindi With Cashews & Coconut Sabzi Recipe,265
Konkan Style Vali Bhajji Ambat Recipe-Spiced Malabar Spinach Dal,266
Garlic Naan Without Yeast Recipe,267
Arbi Ka Saag Recipe,268
Butter Garlic Naan Recipe - Garlic Flavoured Flatbread,269
लहसुनि दाल रेसिपी - Garlic Dal (Recipe In Hindi),270
Tamter Wangun Recipe,271
Baingan Methi Ka Bharta Recipe with Pomegranates,272
Easy Potato Kurma Recipe,273
Suva Methi Baingan Sabzi Recipe ( Eggplant in Dill and Methi leaves Curry Recipe),274
आलू अमृतसरी रेसिपी - Aloo Amritsari (Recipe In Hindi),275
Karela Aur Baingan Ki Sabzi Recipe - Bitter Gourd Brinjal Sabzi,276
Thatta Payaru Sambar Recipe - Black Eyed Beans Sambar,277
केरला स्टाइल वेदक्कै पछड़ी रेसिपी - Kerala Style Vendakkai Pachadi (Recipe in Hindi),278
Sobji Diye Bhaja Muger Dal Recipe - Bengali Style Moong Dal with Winter Vegetables,279
Rajasthani Ghasela Recipe (Besan Ka Pitta),280
गोभी स्टू रेसिपी - Cauliflower Coconut Milk Stew (Recipe In Hindi),281
Urulaikizhangu Podi Poriyal Recipe (Spicy Potato Sabzi from Tamil Nadu),282
Sweet Potato And Broccoli Sabzi Recipe,283
Pudina Quinoa Recipe,284
बंगाली स्टाइल शाक भाजा रेसिपी - Stir Fried Green Amaranth Leaves (Recipe In Hindi),285
Gujarati Vaghareli Mag Recipe - Whole Green Moong Dal Sabzi Recipe,286
Konkani Style Sol Kadhi Recipe - Kokum Flavored Coconut Curry,287
Chilli Cheese Paratha Recipe,288
मूलांगी तौव्वे रेसिपी - Moolangi Tovve Recipe,289
Kongunadu Kathirikai Rasam Recipe - Spicy & Tangy Eggplant Rasam,290
बीटरूट पोरियल रेसिपी - Beetroot Poriyal (Recipe In Hindi),291
Mushroom Methi Brown Rice Recipe,292
Barnyard Millet Bisi Bele Bath Recipe,293
Maharashtrain Amti Recipe,294
अचारी पनीर रेसिपी - Spicy Pickled Paneer Gravy (Recipe In Hindi),295
Karnataka Style Avarekalu Huli Saru Recipe (Field Beans in a Coconut based Gravy Recipe),296
गोबी के कोफ्ते रेसिपी - Gobi Ke Kofte (Recipe In Hindi),297
मटर कीमा रेसिपी - Matar Keema (Recipe In Hindi),298
सिंधी कढ़ी रेसिपी - Sindhi Kadhi (Recipe In Hindi),299
तोगरिकायी उसली रेसिपी - Togarikaayi Usli Recipe,300
Kothavarangai Poriyal Recipe - South Indian Style Cluster Beans Sabzi,301
Kachcha Kela Masala Sabzi Recipe (Raw Banana with Tomatoes & Spices),302
गोअन मूलयाचो रोस रेसिपी - Goan Moolyacho Ross,303
Coconut Chia Pudding Recipe,304
Rajasthani Gatte Ka Pulao Recipe,305
Carrot And Capsicum Rice Recipe,306
South Indian One Pot Sambar Rice Recipe,307
Bajri Ki Roti Recipe,308
Chole Capsicum Masala Recipe,309
Konkani Style Mooga Ghushi Recipe-Sprouted Whole Green Gram In Tangy Coconut Gravy,310
Mambazha Pulissery Recipe - Mango Mor Kuzhambu Recipe,311
Mangalorean Style Sonay Sukka Recipe - Dry Chickpea Stir Fry,312
Masala Mixed Sprouts Sandwich Recipe,313
"Beetroot, Sweet Potato And Oatmeal Cutlet Recipe",314
Punjabi Lobia Masala Recipe (Punjabi Style Black Eyed Beans Curry),315
Karnataka Style Sorakkai Palya Recipe - Karnataka Style Bottle Gourd Sabzi,316
Pepper Mushroom Stir Fry Recipe,317
Kashmiri Phool Rogan Josh Recipe - Cauliflower in Red Curry,318
Bengali Style Labra Recipe - Mix Vegetable Sabzi,319
दाल बनजारा रेसिपी - Dal Banjara (Recipe In Hindi),320
Sweet Potato & Neem Leaves Vegetable Curry Recipe,321
Kashmiri Style Chokh Vangun Recipe - Baingan Masala,322
Vazhakkai Varuval Recipe- Raw Banana Roast Recipe,323
पेशावरी काला चना रेसिपी - Peshawari Kala Chana (Recipe In Hindi),324
Karwar Style Kairichi Udid Methi Recipe (Raw Mango Methi Curry),325
Chow Chow Sambar Recipe (Chayote Squash Sambar),326
Goan Sorak Curry Recipe,327
Danyachi Amti Recipe (Maharashtrian Style Groundnut Curry),328
Pacha Payir Kulambu Recipe (South Indian Style Green Gram Curry),329
Thandu Keerai Poriyal Recipe - Amaranth Leaves Stir Fry,330
Kovakka Thoran (Poriyal) Recipe,331
Jowar Atta Roti Recipe - Sorghum Wheat Phulka Recipe,332
Pavakkai Poriyal Recipe - Karela Ki Sabzi,333
माँगा ओगरे रेसिपी - Manga Ogre Recipe,334
लोबिया मसाला रेसिपी - Lobia Masala Recipe,335
Paneer Makhana Gulgule Chaat Recipe - No Onion No Garlic,336
पालक चना दाल रेसिपी - Palak Chana Dal Recipe,337
Shikampuri Kebab Recipe - Kebabs made with Brown Chickpeas,338
Dum Ke Baingan Recipe,339
Chettinad Poondu Rasam Recipe | Spicy Garlic Rasam,340
Bonda Mor Kuzhambu Recipe,341
Chana Turai/Nenua Chana Sabzi Recipe (Ridge Gourd with Black Chana Recipe),342
Lahsuni Paneer Recipe - Paneer Flavoured With Garlic,343
Kandathippili Rasam Recipe - Long Pepper Rasam,344
"Sweet Potato, Broccoli And Tofu Curry Recipe",345
Capsicum Masala Poriyal Recipe (South Indian Style Bell Pepper Stir Fry),346
Pudina Rice Recipe,347
Kathal Masaledar Sabzi Recipe - Jackfruit Masala Sabzi,348
Achari Aloo Sabzi Recipe - Potatoes In Spicy Pickle Masala,349
Palak Paneer Bhurji Recipe -Spiced Cottage Cheese Scramble With Spinach Recipe,350
Jain Style Dal Makhani Recipe,351
Adraki Rajma Masala Recipe - Rajma Masala Recipe,352
Paneer Kundan Kaliyan Recipe,353
Tamatar Wali Arbi Sabzi Recipe,354
Kathirikai Urulai Kizhangu Kara Kuzhambu Recipe,355
Masala Akki Roti Recipe - Spicy Rice Flour Flatbread,356
Kongunadu Special Pattani Biryani Recipe (Green Peas Biryani From Kongunadu),357
Jowar Garlic Naan Recipe- Healthy Sorghum Naan,358
Allahabadi Tehri Recipe (UP Style Vegetable Rice),359
Kale Chane Ki Kadhi Recipe - Black Chickpea Kadhi,360
Vendakkai Poriyal Recipe (South Indian Style Okra Stir Fry Spiced With Sambar Powder),361
Cabbage Besan Fry Recipe,362
Jeera Rice Recipe - Cumin And Ghee Flavored Rice,363
Raw Jackfruit Kofta Curry Recipe - Kathal Kofta Curry Recipe,364
Vegetable Biryani Recipe With Chatpata Aloo,365
Farali Aaloo Pattice Recipe,366
North Arcot Special Godumai Rava Puliyodharai Recipe - Broken Wheat/Dalia Puliogare,367
Ringan Methi Nu Shaak Recipe - Gujarati Style Eggplant & Fenugreek Leaves Sabzi,368
Manipuri Style Sana Thongpa Recipe-Paneer and Green Beans in Milk Gravy Recipe,369
Brinjal Mor Kuzhambu Recipe,370
Arbi Ke Kebab Recipe (Spicy Colocasia Kebab) Recipe,371
Ragi Wheat Phulka Recipe- Diabetic Friendly Ragi Roti,372
Bhugi Dal Paratha Recipe - Moong Dal Paratha,373
Gujarati Wadi Pulao Recipe,374
खट्टा मीठा लौकी करी रेसिपी - Tangy and Sweet Bottle Gourd Curry (Recipe In Hindi),375
Carrot Paruppu Usili Recipe - Steamed Lentils Crumbled With Carrots,376
Bharwa Baingan Aur Pyaaz Ki Sabzi Recipe - Roz Ka Khana With Figaro Olive Oil,377
Dahi Suran Ki Sabzi Recipe (Stir Fried Yam in Dry Yogurt Curry Recipe),378
Goan Style Tonak Alsanyache Recipe (Black eyed beans cooked in Tonak Masala Recipe),379
Homemade Paneer Recipe,380
Avarekalu Tikki Recipe,381
Andhra Style Pappu Charu Recipe (Lentil Soup Style Curry),382
Chettinad Beetroot Kurma Recipe,383
Palak Chole Recipe (Spinach & Chickpea Curry),384
Kondai Kadalai Puli Kuzhambu Recipe -Tangy South Indian Kala Chana Curry,385
Matar Masala Recipe - Peas In Onion Tomato Gravy,386
Aloo Gajar Matar Sabzi Recipe,387
Pudalangai Poriyal Recipe  - Snake Gourd Poriyal Recipe,388
पेशावरी छोले रेसिपी - Peshawari Chole (Recipe In Hindi),389
कद्दू की सब्ज़ी रेसिपी - Pumpkin Sabzi With Panch Phoron Masala (Recipe In Hindi),390
Bajra Aloo Paratha Recipe,391
Crunchy Carrot Peanut Raita Recipe - Gajar Moongphali Raita,392
Carrot Lemon Rice Recipe,393
Mushroom Biryani Recipe,394
Gawar Ki Sabzi Recipe - Cluster Beans Curry,395
गोअन मशरुम विंडालू रेसिपी - Goan Style Mushroom Vindaloo (Recipe In Hindi),396
Milagu Jeera Curry Leaf Sadam Recipe,397
Masala Vada Curry Recipe - Chana Dal Vada Curry Recipe,398
Punjabi Kadhi Pakora Recipe - Delicious Punjabi Kadhi,399
Red Lentil Curry Without Coconut Recipe,400
Aloo Gobi Sabzi Recipe - Potato And Cauliflower Dry Curry,401
No Onion No Garlic Lauki Paneer Kofta Curry Recipe,402
Ulundogorai - Spicy Urad Dal flavoured Rice (for Prashad & Naivedyam) Recipe,403
Malwani Pumpkin And Raw Mango Curry Recipe,404
खट्टी कद्दू की सब्ज़ी रेसिपी - Tangy Tamarind Pumpkin Curry (Recipe In Hindi),405
Kashmiri Style Chaman Recipe-Qaliya Cottage Cheese Curry,406
Andhra Style Bangaladumpa Vepudu Recipe - Potato Fry Recipe,407
राबोडी शिमला मिर्च की सब्ज़ी रेसिपी - Rajasthani Curry with Corn Papad (Recipe In Hindi),408
अवधी खट्टी अरबी का सालन रेसिपी - Awadhi Style Khatti Arbi Ka Salan (Recipe In Hindi),409
