RecipeName,0
Indian Spiced Brussel Sprouts Sabzi Recipe (Brussel Sprouts Stir Fry),410
Moong Matar Kebab Recipe - Green Lentil And Peas Kebab,411
Baby Corn and Green Peas Sabzi Recipe,412
Veg Tunday Kabab Recipe,413
दही वाले आलू रेसिपी - Dahi Wale Aloo (Recipe In Hindi),414
करामानी पोरियल रेसिपी - Karamani Poriyal (Recipe In Hindi),415
चाउ चाउ करी रेसिपी - Chow Chow Curry Recipe,416
Roasted Bell Pepper Rasam Recipe,417
Punjabi Style Lobia Masala Recipe (Black Eyed Peas Masala),418
मूंगफली की करी रेसिपी - Peanut Curry (Recipe In Hindi),419
Andhra Style Munakkada Masala Kura Recipe - Drumstick Dry Curry Recipe,420
Kasuri Methi Chole Recipe,421
Dal Vangi Recipe - Spicy Lentils with Roasted Eggplant,422
कोवक्का थोरन रेसिपी - Kovakka Thoran (Recipe In Hindi),423
Whole Wheat Beetroot Paratha Recipe,424
Karwar Style Khatkhate Recipe (Mixed Vegetable Curry With Toor Dal & Coconut),425
Khatti Meethi Mirchi Ki Sabzi Recipe,426
Palak Kichdi Recipe,427
हरी मिर्च की सब्ज़ी रेसिपी - Green Chilli Vegetable (Recipe In Hindi),428
Paneer Pyaz Paratha Recipe,429
Spicy Coconut Peanut Stuffed Baby Brinjal Recipe,430
आलू पोतोल पोस्तो रेसिपी - Aloo Parwal In Poppy Seed Masala (Recipe In Hindi),431
Bengali Posto Porota Recipe (Spiced Poppy Seed Parathas),432
Kashmiri Style Dum Oluv Recipe - Dum Aloo Recipe,433
Tamil Nadu Style Karamani Murungakkai Kuzhambu Recipe-Black eyed Beans & Drumstick Curry,434
Mughlai Style Aloo Matar Gobi Gravy Recipe,435
Aloo Subz Dum Biryani Recipe,436
Methi Sprouts Salad Recipe - Healthy & Tasty Diabetic Snack,437
Hunase Saaru Recipe - Mysore Style Spicy Tamarind Rasam,438
Mixed Vegetable Handi Recipe,439
Pita Saga Bati Basa Recipe,440
Mint Coriander Spice Pulao Recipe,441
Chettinad Kathirikai Chops Recipe - Brinjal Curry for Biryani,442
Konkan Style Modachya Moongachi Amti Recipe-Sprouted Moong Bean Curry,443
बटाटा नु शाक रेसिपी - Batata Nu Shaak (Recipe In Hindi),444
Paneer Raw Mango Curry Recipe,445
छेना उप्पेरि रेसिपी - Eggplant Foot Yam Stir Fry Recipe,446
Hara Pyaz Paratha Recipe - Spring Onion Paratha Recipe,447
Shahi Dal Recipe,448
निम्बू पुदीना कढ़ी पत्ता शिकंजी रेसिपी - Lemon Pudina Curry Leaf Shikanji Recipe in Hindi,449
गाजर शिमला मिर्च दाल रेसिपी - Carrot And Capsicum Mix Dal Recipe,450
आलू विंडालू रेसिपी - Potato Vindaloo Recipe,451
Panchmel Dal Recipe | Rajasthani Dal | Panchkuti Dal,452
पहाड़ी स्टाइल फनु रेसिपी - Pahari Style Phanu Recipe,453
चनार दालना रेसिपी - Chanar Dalna (Recipe In Hindi),454
Kerala Style Eggplant Curry Recipe,455
Carrot Puree Recipe - First Food For Babies,456
Cranberry Whole Wheat Naan Recipe,457
Methi Masoor Dal Recipe With Whole Masoor,458
Karnataka Style Badnekayi Mosaru Gojju Recipe,459
लोबिया मसाला रेसिपी - Lobia Masala (Recipe In Hindi),460
Whole Wheat Methi Garlic Naan Recipe  | Oven Method with yeast,461
Hariyali Paneer Tikka Masala Gravy Recipe -No Onion No Garlic Recipe,462
Gavar Pumpkin Sabji Recipe,463
Whole Wheat Spinach Paneer Lifafa Paratha Recipe,464
Himachali Khatta Recipe (Tangy Black Chickpea Curry),465
Burnt Garlic Mushroom Fried Rice Recipe,466
अचारी बैंगन भरता रेसिपी - Achari Baingan Bharta (Recipe In Hindi),467
दाल कबीला रेसिपी - Dal Kabila Recipe,468
One Pot Tomato Rice Recipe Using Preethi Electric Pressure Cooker - Thakkali Sadam,469
Aloo Beans Sabzi Recipe - Potato & Beans Stir Fry,470
Hunase Gojju Recipe,471
Kadai Mushroom Recipe,472
Maharashtrian Style Farasbi Chi Bhaji Recipe - Beans Cooked With Peanuts,473
Maize Daliya Khichri Recipe,474
Spiced Beetroot Buttermilk Recipe,475
Pumpkin Chapati Recipe,476
Soya Chunks Pepper Curry Recipe,477
Buttered Peas Puree Recipe For Babies Above 6 months,478
Sprouted Ragi & Rajma Cutlets Recipe,479
Paneer in White Gravy Recipe - No Onion No Garlic Recipe,480
Thor Chal Recipe - Banana Stem Pulao Recipe,481
Stuffed Karela With Aloo Recipe,482
Spicy Soya Keema Masala Recipe,483
Kothamalli Karuveppilai Sadam Recipe - Coriander And Curry Leaves Rice,484
Senai Kizhangu Gotsu Recipe - Spicy & Tangy Yam Curry Recipe,485
Mughlai Fish Curry Recipe,486
Bengali Style Mixed Vegetable Sweet Pilaf Recipe,487
Karnataka Style Obbattu Saaru Recipe - Sweet & Spicy Rasam Recipe,488
Methi & Pudina Aloo Sabzi Recipe,489
Parsi Style Baingan Capsicum Ka Salan Recipe,490
Instant Chilli Pickle Recipe,491
Rawalpindi Style Chole Recipe,492
Achari Kaddu Ki Sabzi Recipe,493
Veg Makhanwala Recipe - North Indian Mixed Vegetables Gravy,494
Sindhi Style Besan Tikki Ki Sabzi Recipe,495
Spicy Matar Masala Recipe,496
Andhra Style Davva Aava koora Recipe (Sweet and Spicy Banana Stem Peanut Curry Recipe),497
Spinach Khandvi Recipe - Savory Gram Flour Pinwheels With Spinach,498
Spiced Onion Pulao Recipe - Pyaz Pulao Recipe,499
Curd Rice With Carrots Recipe,500
Hyderabadi Khatti Dal Recipe (Hyderabadi Tangy Lentil Curry),501
Singhara Atta Cheela Recipe (No Onion No Garlic Navratri Fasting/Vrat Recipe),502
Spicy Tomato Rice - Tomato Pulihora Recipe,503
Bengali Holud Mishti Pulao Recipe - Saffron Flavored Rice With Nuts,504
Chotti Aloor Dum Recipe - Baby Potatoes In Tomato Gravy,505
Mooli Bhurji Recipe,506
Bisi Bele Bath Recipe - A Spicy Mixed Vegetable Sambar Rice,507
Karnataka Style Hurali Kalu Saaru Recipe,508
Beerakaya Tomato Koora Recipe (Andhra Style Ridge Gourd Curry),509
Amritsari Gobi Matar Recipe (Punjabi Style Creamy Cauliflower and Peas Curry),510
Congress Buns Recipe,511
Methi Moong Dal Recipe - Healthy Diabetic Friendly Recipe,512
Andhra Vankaya Fry Recipe With Peanuts - Brinjal Peanut Sabzi,513
One Pot Masala Vegetable Rice Recipe,514
Raw Mango Puliyogare Gojju Recipe With Peanuts,515
Stuffed Bharwa Tinda Recipe (Stuffed Apple Gourd),516
Tadkewali Masoor Dal Khichdi Recipe With Garlic & Onions,517
Maharashtrian Kulith Shengole Recipe - Spicy Horse Gram Flour Dumplings,518
Paruppu Urundai Mor Kuzhambu Recipe(Lentil Balls in Yogurt Curry),519
Himachal Pahari Style Teliah Mah Recipe (Brown Horse Gram Curry),520
Arbi Ajwain Ki Sabzi Recipe (Roasted Colocasia Stir Fry With Ajwain),521
Barnyard Millet Mushroom Biriyani Recipe,522
Orange Peel Kuzhambu Recipe - Orange Peel Tamarind Based Curry,523
Puliyodharai / Puliyogare Recipe (using Millets),524
Maharashtrian Masale Baath Recipe - Spicy Vegetable Rice with Goda Masala,525
Karnataka Style Badanekai Yennegai Gojju Recipe (Stuffed Brinjal Recipe),526
निरामिष आलू दम रेसिपी - Niramish Aloo Dum Sabzi (Recipe In Hindi),527
पत्ता गोभी थोरन रेसिपी - Cabbage Thoran/Poriyal Recipe,528
गाजर और बीन्स का थोरन रेसिपी - Carrot and Beans Thoran (Recipe In Hindi),529
Masoor Dal Aur Rajma Masala Recipe,530
Dhaba Style Green Moong Dal Tadka Recipe,531
Goan Pumpkin Sabzi Recipe,532
Spicy Schezwan Vegetable Noodles Recipe,533
Maharashtrian Style Kakdichi Amti (Cucumber Gravy Recipe),534
No Onion And No Garlic Aloo Gajar Matar Ki Sabzi Recipe,535
Veg Chilli Milli Recipe,536
Kathal Biryani Recipe- Raw Jackfruit Biryani Topped with Caramelised Onions,537
अरहर की दाल रेसिपी - Arhar Ki Dal with Lahsun Tadka (Recipe In Hindi),538
आलू गाजर की सब्ज़ी रेसिपी - No Onion No Garlic Aloo Gajar Ki Sabzi (Recipe In Hindi),539
Bhoplyache Gharge Recipe (Maharashtrian Style Sweet Pumpkin Puris),540
Sama Khichdi Recipe - Barnyard Millet Khichdi -Navratri Fasting - Vrat Recipe,541
Paneer Kulcha Recipe-Cottage Cheese Stuffed Leavened Flatbread,542
पुदीना मूंग दाल रेसिपी - Pudina Moong Dal (Recipe In Hindi),543
मूंग दाल सुखी सब्ज़ी रेसिपी - Moong Dal Sookhi Sabzi (Recipe In Hindi),544
ढाबा स्टाइल हरी मूंग दाल तड़का रेसिपी - Dhaba Style Green Moong Dal Tadka (Recipe In Hindi),545
मेथी मटर पुलाव रेसिपी - Methi Matar Pulao (Recipe In Hindi),546
Spicy Rice Stuffed Paratha Recipe,547
ब्रोकली पनीर और मूंगफली मसाला रेसिपी - Broccoli Paneer And Peanut Masala (Recipe In Hindi),548
Tamil Nadu Style Ulundhu Kuzhambu Recipe - Black Lentil Curry,549
Stuffed Capsicum With Sweet Potato Recipe,550
Chettinad Style Puliyogare Gojju Recipe,551
Moong Sprouts Pulao Recipe,552
Bajra Kaddu Ki Roti Recipe - Bajra Pumpkin Roti Recipe,553
मूली की सब्ज़ी रेसिपी - Mooli Ki Sabzi (Recipe In Hindi),554
मुलाकुतल रेसिपी - Vegetables In Coconut Gravy (Recipe in Hindi),555
Andhra Style Pulihora Recipe (Spicy & Tangy Tamarind Rice),556
पंजाबी स्टाइल टिंडा सब्ज़ी रेसिपी - Punjabi Style Tinda Sabzi Recipe,557
Pudina Rasam Recipe - Mint Leaves Rasam,558
Makai Wali Bhindi Recipe,559
Broccoli Capsicum Pulao Recipe,560
Kathirikai Poondu Pirattal Recipe - South Indian Style Brinjal Stir Fry With Garlic,561
Bengali Aloo Jhinge Posto Curry Recipe (Potato and Ridge Gourd Curry),562
Bhogichi Bhaji Recipe (Maharashtrian Mixed Vegetable Stir Fry),563
Mangalore Cucumber Chana Dal Subzi Recipe,564
Mushroom Curry Recipe,565
वाघरेला चावल रेसिपी - Vagharela Chawal Recipe,566
अवधी स्टाइल तहरी रेसिपी - Awadhi Style Taheri (Recipe In Hindi),567
Besan Katli Ki Sabzi Recipe,568
Bengali Style Khichuri Aar Labra Recipe-Khichdi And Mixed Vegetables,569
Mulangi Thoran Recipe - Radish Stir Fry With Coconut,570
Bellada Coffee Recipe With Milk (Karnataka Style Filter Coffee With Jaggery),571
कढ़ी पकोड़ा रेसिपी - Kadhi Pakoras (Recipe In Hindi),572
सेनाइ किजहांगु वरुवल रेसिपी - Senai Kizhangu Varuval Recipe,573
Tamatari Chole Recipe,574
Horsegram Dal Recipe - Kulith/Kollu Dal,575
Kobbari Charu Recipe - Coconut Milk & Dal Sambar Recipe,576
Malai Kofta Curry Recipe - Creamy and Healthy Paneer Aloo Kofta Curry,577
Achari Masala Powder Recipe,578
Konkani Style Alasande Randayi Recipe-Black Eyed Beans and Yam Gravy,579
Moolangi Tovve Recipe - Radish Curry,580
आलू शिमला मिर्च की सब्ज़ी रेसिपी - Aloo Simla Mirch Ki Sabzi (Recipe In Hindi),581
Carrot And Broccoli Poriyal Recipe,582
Dhaba Style Dal Fry Recipe,583
Chow Chow Milagu Kootu Recipe-Chayote Squash Cooked in Peppery Lentil Curry,584
Cheese Garlic Naan Recipe,585
Paneer Biryani Recipe,586
Tamil Nadu Style Paneer Kurma Recipe,587
Pudina Buttermilk Recipe,588
Kashmiri Paneer Gravy Recipe,589
काबुली चना सूप रेसिपी - Chickpea Soup Recipe,590
Watermelon Rasam Recipe,591
Bannada Saute Majjige Huli Recipe (Malabar Cucumber Mor Kuzhambu),592
मटर मसाला रेसिपी - Matar Masala Recipe,593
Kumror Chokka Recipe - Kaddu Kala Chana Sabzi | Pumpkin Chickpea Curry,594
"Oats, Peas & Tofu Stuffed Paratha Recipe",595
Vadyancho Ross Recipe (Ash Gourd Chips Curry),596
तीखा आलू रोस्ट रेसिपी - Spicy Potato Roast Recipe (Recipe In Hindi),597
Sichuan Dan-Dan Noodles Recipe (Sesame Noodles With Crispy Tofu Recipe),598
सोया चंक्स सब्ज़ी रेसिपी - Soya Chunks Sabzi (Recipe In Hindi),599
वेज मक्खनवाला रेसिपी - Veg Makhanwala Recipe,600
Goan Vegetable Curry Recipe,601
Rajasthani Kadhi Recipe,602
Dal Vada with Oats and Vegetable Recipe,603
महाराष्ट्रियन वरन फाल रेसिपी - Maharastrian Varan Phal Recipe,604
"Gujarati Badshahi Pulao Recipe - A Rich Preparation Of Rice, Vegetables, Nuts And Spices",605
Raw Banana Thoran Recipe,606
Creamy Kulfi Kebab Recipe With Tandoori Mayo Recipe,607
Moong Dal Sookhi Sabzi Recipe,608
ब्रोकली और आलू पोरियल रेसिपी - Broccoli And Aloo Poriyal Recipe (Recipe In Hindi),609
Bengali Chapor Ghonto Recipe-Moong Dal With Vegetables,610
Simple Steamed Indian Beet Salad Recipe,611
पम्पकिन दाल लहसुनि तड़के के साथ रेसिपी - Pumpkin Dal With Garlic Tadka (Recipe In Hindi),612
Nawabi Mixed Vegetable Gravy Recipe,613
Lobia Kebabs Recipe (Black Eyed Bean Patties),614
Peshawari Kala Chana Recipe,615
Peas Pulao Recipe -  North Indian Matar Pulao,616
हरा धनिया पराठा रेसिपी - Hara Dhania Paratha Recipe,617
Gulachi Poli Recipe (Jaggery And Poppy Seeds Stuffed Paratha),618
Dubki Wale Aloo Recipe - Potatoes In A Spicy North Indian Gravy,619
Paruppu Urundai Rasam Recipe - Dal Dumpling Rasam,620
Chinna Vengaya Puli Kuzhambu Recipe (Spicy Tangy Baby Onion Curry),621
How To Make Homemade Almond Flour Recipe,622
Arachuvitta Sambar Recipe - Sambar With Fresh Ground Spices,623
राबोडी की सब्ज़ी रेसिपी - Rabodi Ki Sabzi (Recipe In Hindi),624
Maharastrian Batatyachi Bhaji Recipe-Quick and Simple Aloo Sabzi,625
Gopalkala Recipe - Janmashtami Special),626
Peach Lassi Recipe - Peach Yogurt Smoothie,627
Malabar Parotta Recipe - Kerala Parotta Recipe,628
Lahori Aloo Recipe,629
Tangy Tamarind Pumpkin Curry Recipe,630
Andhra Style Aratikaya Vepudu Recipe - Raw Banana Dry Sabzi,631
Rajasthani Dal Recipe,632
Bhindi Masala Curry Recipe,633
Matar Masala Tofu Recipe,634
Broccoli And Aloo Lifafa Paratha Recipe,635
Tawa Tandoori Roti Recipe,636
Stuffed Capsicum Makhani Recipe,637
Broken Wheat And Green Moong Khichdi Recipe,638
Moroccan Baked Fish Recipe,639
Chickpea Tikka Masala Recipe,640
Vellarikka Kosumalli Recipe- South Indian Style Cucumber Salad,641
Baked Amritsari Kulcha Recipe (Without Yeast),642
North Indian Chawli ki Sabzi Recipe | Yard Long Beans | Barbati | Karamani,643
Roasted Coriander Potatoes With Thyme Recipe,644
"Methi Makhana Mutter Korma Recipe - Methi, Green Pea & Lotus Seeds Curry",645
Foxtail Millet Lemon Rice Recipe-Elumichai Thenai,646
Spicy Sweet Corn & Oat Fritters Recipe - Corn Masala Vada,647
Chilli Paneer Recipe -Indo Chinese,648
Chatpata Kala Chana Pakora Roll/ Frankie Recipe,649
Seppakizhangu Roast (South Indian Style Arbi Fry) Recipe,650
Tulsi And Betel Leaves Rasam Recipe,651
Khichdi With Fresh Spices Recipe,652
Stuffed Masala Aloo Naan Recipe Made Without Oven,653
Palak Tambuli Recipe (Udupi Style Spinach Tambli),654
Semiya Biryani Recipe,655
Apple Puree Recipe (Baby Food - 4 months onwards),656
Nawabi Tawa Paratha Recipe,657
Niramish Aloo Dum Recipe,658
Kerala Style Tomato Fry Recipe,659
Mangalore Style Nurge Gashie Recipe-Spicy Drumstick Curry,660
Crispy & Spicy Paneer Starter Recipe,661
Aloo Amritsari Recipe,662
Chapor Ghonto Recipe (Bengali Mix Vegetable With Lentils Patties),663
Awadhi Style Chickpea Kofta Biryani Recipe,664
Dry Chilli Baby Corn Recipe (Indian Chinese Style Recipe),665
Kela Matar ki Sabzi Recipe - Raw Banana Green Peas Stir Fry,666
Paalkatti Chettinad Curry Recipe -Chettinad Style Paneer Kurma Recipe,667
Mango Shikanji Recipe - Chatpata Mango Spritzer,668
Cauliflower Kurma (Tamil Nadu Restaurant Style Cauliflower Chops) Recipe,669
Kerala Pumpkin Black Eyed Beans Erissery Recipe,670
Fennel Turmeric Walnut Soup With Apple And Raw Mango Recipe,671
South Indian Style Vegetable Kurma Recipe,672
Karnataka Style Bassaru Recipe - Dill flavored Coconut Rasam,673
Spicy Cabbage Rice Recipe (South Indian Style Mutta Kose Sadham Recipe),674
दाल वांगी रेसिपी - Dal Vangi Recipe,675
Mulakootal Recipe (Vegetables In Coconut Gravy),676
Elaneer Rasam Recipe - Tender Coconut Rasam,677
Green Beans Fry Recipe,678
पालक बैंगन की सब्ज़ी रेसिपी - Palak Baingan Ki Sabzi (Recipe In Hindi),679
मालवानी कुरकुरी भिंडी रेसिपी - Malvani Kurkuri Bhindi Recipe,680
कथीरिकै पुंडु पिरात्तल रेसिपी - Kathirikai Poondu Pirattal Recipe,681
केगरी पिरात्तल रेसिपी - Chettinad Style Mixed Vegetable Recipe,682
Sindhi Tidali Dal Recipe,683
"Mushroom, Paneer And Soya Chunk Samosa Recipe",684
Khatte Pudina Aloo Recipe - Tangy Mint Potatoes,685
Crispy Amla Gawar Phali Sabzi Recipe,686
Narangi Pulao Recipe  - Orange Flavoured Rice,687
Parwal Masala Recipe - No Onion No Garlic Recipe,688
Vazhaipoo Podimas Recipe  - Banana Flower Poriyal/ Sabzi,689
Chow Chow Verkadalai Masala Curry Recipe - Chayote Peanut Poriyal Recipe,690
Pazhutha Manga Pachadi Recipe - Kerala Style Ripe Mango Curry,691
Goan Style Mushroom Shagoti Recipe,692
Vagharelo Bhaat Recipe - Gujarati Masala Rice,693
No Onion No Garlic Raw Tomato Sabzi Recipe,694
Kumaoni Style Palak & Methi Ka Kapa Recipe,695
पका केला की सब्ज़ी रेसिपी - Paka Kela Ki Sabzi (Recipe In Hindi),696
सोया चंक्स मसाला रेसिपी - Soya Chunks Masala in Coconut Milk (Recipe  In Hindi),697
Chikkudukaya Vepudu Recipe-Broad Beans Masala Poriyal,698
Bendekaayi Gojju (Lady Finger In Coconut Curry) Recipe,699
गाजर मेथी पचड़ी रेसिपी - Carrot Methi Pachadi (Recipe In Hindi),700
Tomato Quinoa Recipe  - With A South Indian Twist,701
Chamadumpa Vepudu Recipe - Andhra Style Colocasia Stir Fry,702
Savoury Oatmeal Porridge Recipe,703
Mushroom Poha Cutlets Recipe,704
Whole Wheat Lachha Paratha Recipe-Multilayered Layered Indian Flat Bread,705
आलू भिन्डी की सब्ज़ी रेसिपी - Spicy Potatoes and Lady's Finger Stir Fry (Recipe In Hindi),706
Soft & Delicious Ragi Mudde Recipe - Karnataka Style Ragi Balls,707
Arbi Shimla Mirch Sabzi Recipe – Colocasia Capsicum Sabzi,708
चमन कालिया रेसिपी - Chaman Qaliya (Recipe In Hindi),709
मिलागु सदम रेसिपी - Milagu Sadam (Recipe In Hindi),710
चनार पतुरी रेसिपी - Chanar Paturi (Recipe In Hindi),711
Tirunelveli Sodhi Kuzhambu Recipe - Mixed Vegetable Stew,712
Amtekai Gojju Recipe - Indian Hog Plum Curry,713
Makhana Moongphali Ki Kadhi Recipe - Navratri Fasting/Vrat Recipe,714
Sindhi Dharan Ji Kadhi Recipe - Besan Tikkis In Tomato Gravy,715
Chinese Spiced Noodle Cutlets Recipe,716
Bloomed Potato Cheesy Muffins Recipe,717
सरसों वाली आलू भिंडी की सब्ज़ी रेसिपी - Aloo Bhindi (Recipe In Hindi),718
Indian Style Kala Chana Salad Recipe,719
No Onion No Garlic Oriya Style Moong Dalma Recipe,720
Spicy Eggplant & Capsicum Curry (Indo-Chinese Fusion Recipe),721
Thakkali Gotsu Recipe | Thakkali Curry | Spicy & Tangy Tomato Gravy,722
Dal Fry Recipe,723
Raw Banana Bajji Recipe- Balekai Bajji | Vazhakkai Bajji,724
Tofu Masala Rice Recipe (Tofu Pulao),725
Layered Paneer Butter Masala Biryani Recipe,726
Spicy Aloo Naan Recipe,727
Chole Pindi Recipe (Spicy Chickpea Curry),728
Traditional Amritsari Chole Recipe | Punjabi Chole Masala,729
Palak Pappu Recipe - Andhra Style Palakura Pappu - Dal Palak,730
Tok Dal Recipe (Bengali Style Masoor Dal),731
बिहारी स्टाइल बैंगन का चौखा रेसिपी - Bihari Style Baingan Ka Chokha (Recipe In Hindi),732
Sindhi Dal Pakwan Recipe - A Delicious Sindhi Breakfast,733
Chilli Paneer Momo Recipe,734
पाइनएप्पल जल जीरा रेसिपी - Pineapple Jal Jeera Recipe,735
Achari Paneer Masala Recipe,736
Murungai Keerai Sambar Recipe - Drumstick Leaves Sambar,737
Methi Turai Ki Sabzi (Fenugreek Leaves And Ridge Gourd Stir Fry),738
Chettinad Vegetable Pulao Recipe,739
बिना प्याज लहसुन के कच्चे टमाटर की सब्ज़ी रेसिपी - No Onion No Garlic Raw Tomato Sabzi (Recipe In Hindi),740
पालक पप्पू रेसिपी -Spinach Dal (Recipe In Hindi),741
Ridge Gourd Tambli Recipe - Spicy Ridge Gourd in Coconut Curry,742
Tandoori Aloo Tikka Recipe - Indian Spiced Roasted Smoked Potatoes,743
केला बेसनी सब्ज़ी विधि रेसिपी - Kela Besani Sabzi Recipe,744
Amlechi Uddamethi Recipe - Goan Raw Mango Curry,745
Restaurant Style Green Peas Masala Recipe,746
ढाबा स्टाइल दाल फ्राई रेसिपी - Dhaba Style Dal Fry (Recipe In Hindi),747
Bharli Bhendi Recipe - Maharashtrian Style Stuffed Bhindi,748
Pyaz Wali Bhindi Recipe | Bhindi Do Pyaza - Okra Onion Stir Fry,749
Achari Lachha Paratha Recipe-Spicy Indian Style Flaky Bread,750
Multani Kaali Arbi Recipe (Arbi Gravy Style),751
Lemon Pudina Curry Leaf Shikanji Recipe,752
जीरा आलू सब्ज़ी रेसिपी - Jeera Aloo Sabzi (Recipe In Hindi),753
Moongphali Bhindi Recipe - Okra and Peanut Stir Fry,754
Vankaya Gasagasala Kura | Andhra Style Eggplant Poppy Seeds Curry Recipe,755
Kathiyawadi Shaak Recipe,756
Rajasthani Dal Muthiya Recipe,757
Dosakaya Pappu Recipe-Andhra Style Yellow Cucumber Dal,758
भोगिची भाजी रेसिपी - Bhogichi Bhaji (Recipe In Hindi),759
दाल तड़का रेसिपी - Dal Tadka Recipe Flavoured With Lemon And Coriander,760
Murungai Keerai Poriyal With Moong Dal Recipe,761
Goan Mushroom Xacuti Recipe,762
दोंडकई पुली करी रेसिपी - Dondakkai Puli Curry Recipe,763
Corn Stuffed Paratha Recipe,764
Kongunadu Urulai Kurma Recipe (Curried Potatoes from Kongunadu),765
Puli Koozh Recipe - Rice Flour Porridge In Tamarind,766
Soya Pilaf/Pulav Recipe,767
बिना प्याज लहसुन वाली लोबिया की सब्ज़ी रेसिपी - No Onion No Garlic Black Eyed Beans Curry (Recipe In Hindi),768
Vazhaithandu Mor Kootu Recipe (Tamil Nadu Style Banana Stem Recipe),769
Nagori Puri Recipe (Semolina Puri),770
Palak Matar Recipe - Spinach And Green Peas Curry,771
Bengali Style Sheem Poshto Recipe - Flat Beans In Poppy Seeds,772
Awadhi Moong Dal Ki Goli Recipe - Lentil Dumplings In Tomato Gravy,773
Mughalai Shahi Kaju Aloo Ki Sabzi Recipe,774
Mooli And Moong Dal Sabji Recipe,775
Karnataka Style Sandige Huli Recipe (Toor dal dumplings in Gravy Recipe),776
Aloo Methi Sabzi Recipe - Potato Fenugreek Leaves Sabzi,777
Mulyachi Bhaji Recipe - Goan Style Mooli Ki Sabzi,778
Spicy Chickpeas Aloo Salad Chaat Recipe,779
Spinach Corn & Cheese Momo Recipe,780
Beans Matki Bhaji Recipe - Green Beans Moth Beans Sabzi,781
Kerala Style Chena Mezhukkupuratty Recipe - Yam Stir Fry,782
Vegan Malai Gobhi Recipe,783
Khatti Meethi Palak Khichdi Recipe,784
Mushroom Masala With Corn Recipe,785
Lahsuni Palak Dal Recipe (Spinach & Lentil Curry with Garlic),786
Rajasthani Papad Ki Sabzi Recipe,787
Kandarappam Recipe (Chettinad Sweet Appam),788
Orange Rasam Recipe,789
Jodhpuri Kabuli Recipe,790
Hariyali Dum Aloo Recipe - Potatoes In Spinach Mint Curry,791
Moong Dal Tikki Recipe,792
Bharwa Karela Makhani  Recipe - Stuffed Karela Masala Gravy,793
Gobi Ke Kofte Recipe (Cauliflower Fritters In Spicy Gravy),794
Shahi Vegetable Pulao Recipe,795
Chow Chow And Beans Poriyal Recipe,796
Ellu Sadam Recipe - South Indian Style Til Pulao Recipe,797
Chana Pulao Recipe - Spicy Chickpea Pulao,798
Carrot Cauliflower Peas Sabzi Recipe - Gajar Gobi Matar Sabzi,799
Nellikai Rasam Recipe - Whole Gooseberry Rasam,800
Ginger Garlic Tofu Curry Recipe,801
Banarasi Tamatar Chaat Recipe - Spicy Tomato Chaat,802
Jowar Jo Dodo Recipe - Sindhi Sorghum Roti,803
Carrots Dill and Peanut Sadam - South Indian Style Stir Fried Rice,804
Methi Paneer Bhurji Recipe in Creamy Gravy,805
Manipuri Style Karotkhabi Kanghou Recipe - Bitter Gourd & Potato Stir Fry,806
Mung Pani Recipe - Whole Green Mung Soup,807
Sweet Potato And Moong Sprouts Cutlet Recipe,808
Andhra Style Pappu Urumindi Recipe,809
Lentil Dal with Coconut Milk Recipe,810
Bangaladumpa Thalimpu Recipe - Potato Stir Fry,811
Togarikaayi Usli Recipe (Green Pigeon Peas),812
गोअन स्टाइल ब्रिंजल भरता रेसिपी - Goan Style Brinjal Bharta (Recipe In Hindi),813
लहसुनि चकुंदर रसम रेसिपी - Beetroot Garlic Lemon Rasam (Recipe In Hindi),814
Hare Pyaaz Ki Puri Recipe - Spring Onion Puri,815
Panasa Pottu Pappu Koora Recipe - Jackfruit & Dal Curry,816
Muringakka Manga Mulakushyam - Mango & Drumstick Kootu Curry,817
Punjabi Style Moth Beans Dal Recipe (Matki),818
Pyaaz Ki Sabzi Recipe,819
Manjal Poosanikai Sambar Recipe (Yellow Pumpkin in Toor Dal Recipe),820
Indian Style Beetroot Soup Recipe,821
पंजाबी स्टाइल अरबी की सब्ज़ी रेसिपी - Punjabi Style Arbi (Recipe In Hindi),822
Chana Kanghou Recipe - Manipuri Style Kala Chana Sabzi,823
Khandeshi Sev Bhaji Recipe,824
Methi Mushroom Masala Recipe,825
Milagu Sadam Recipe (Instant Pepper Rice),826
Masala Khichia Recipe (Spicy Corn Flour Papad),827
Phalguni Dal Recipe - Bengali Style Red Lentils With Fresh Green Peas,828
Achari Aloo Parwal Sabzi Recipe (Pointed Gourd And Potato Stir Fry In Pickle Spices),829
Punjabi Sabut Moong Ki Dal Recipe (Whole Green Lentils Cooked With Punjabi Spices),830
किनुआ वांगी भात रेसिपी - Quinoa Vangi Bath Recipe,831
Kali Mirch Aloo Bhindi Sabzi - Aloo Bhindi Pepper Fry Recipe,832
